Draggable Images Block,https://ru.wordpress.org/plugins/draggable-images-block/,Add and move images in your Gutenberg block as you like.,РњРµРЅРµРµ 10 Р°РєС‚РёРІРЅС‹С… СѓСЃС‚Р°РЅРѕРІРѕРє,5.7.12Awesome Slider Block,https://ru.wordpress.org/plugins/awesome-slider-block/,This plugin brings a Awesome Slider Block to the new WordPress Gutenberg editor.,РњРµРЅРµРµ 10 Р°РєС‚РёРІРЅС‹С… СѓСЃС‚Р°РЅРѕРІРѕРє,5.1.19BlocksBuster,https://ru.wordpress.org/plugins/blocksbuster/,This plugin is a collection of blocks that will help in making WordPress sites by using Gutenberg editor. We will build more blocks in the future tha вЂ¦,РњРµРЅРµРµ 10 Р°РєС‚РёРІРЅС‹С… СѓСЃС‚Р°РЅРѕРІРѕРє,5.0.22Blog Blocks вЂ” Gutenberg Blocks for Content Writers,https://ru.wordpress.org/plugins/blog-blocks/,Blocks for content writers to make your articles more attractive to readers with elements such as notices.,РњРµРЅРµРµ 10 Р°РєС‚РёРІРЅС‹С… СѓСЃС‚Р°РЅРѕРІРѕРє,5.2.21Social Gallery Block,https://ru.wordpress.org/plugins/social-gallery-block/,social Posts Display Block,РњРµРЅРµРµ 10 Р°РєС‚РёРІРЅС‹С… СѓСЃС‚Р°РЅРѕРІРѕРє,5.6.14gitblock вЂ” Github Block Plugin,https://ru.wordpress.org/plugins/gitblock/,Overview,РњРµРЅРµРµ 10 Р°РєС‚РёРІРЅС‹С… СѓСЃС‚Р°РЅРѕРІРѕРє,5.5.15Advance Block Extend,https://ru.wordpress.org/plugins/advance-block-extend/,The creative and advance blocks for the Gutenberg.,РњРµРЅРµРµ 10 Р°РєС‚РёРІРЅС‹С… СѓСЃС‚Р°РЅРѕРІРѕРє,5.5.15FF Block Advanced Columns,https://ru.wordpress.org/plugins/ff-block-advanced-columns/,WordPress editor block that provides support for advanced inline grid layouts by extending each column in a columns block with the option to set its w вЂ¦,РњРµРЅРµРµ 10 Р°РєС‚РёРІРЅС‹С… СѓСЃС‚Р°РЅРѕРІРѕРє,5.2.21Builder Blocks,https://ru.wordpress.org/plugins/builder-blocks/,"A library of simple, easy to use blocks for the new WordPress Gutenberg editor.",РњРµРЅРµРµ 10 Р°РєС‚РёРІРЅС‹С… СѓСЃС‚Р°РЅРѕРІРѕРє,5.0.22mowomo Google Reviews,https://ru.wordpress.org/plugins/mowomo-google-reviews/,mowomo Google Reviews is a plugin that allows you to display your Google company ratings on your website using a gutenberg block,РњРµРЅРµРµ 10 Р°РєС‚РёРІРЅС‹С… СѓСЃС‚Р°РЅРѕРІРѕРє,5.5.15Yasothon,https://ru.wordpress.org/plugins/yasothon-blocks/,Yasothon is a cool plugin for the Pages editor that have many several blocks to custom your homepage. It is easy to use you just add block and select  вЂ¦,РњРµРЅРµРµ 10 Р°РєС‚РёРІРЅС‹С… СѓСЃС‚Р°РЅРѕРІРѕРє,5.1.19"Embed Plus for YouTube Gallery, Livestream and Lazy Loading with Facades",https://ru.wordpress.org/plugins/youtube-embed-plus/,"A multi-featured plugin to embed YouTube in WordPress. Embed a video, YouTube channel gallery, playlist, or YouTube livestream. Defer JavaScript too!",100В 000+ Р°РєС‚РёРІРЅС‹С… СѓСЃС‚Р°РЅРѕРІРѕРє,6.8.1GiveWP вЂ” РџР»Р°С‚С„РѕСЂРјР° РґР»СЏ РїРѕР¶РµСЂС‚РІРѕРІР°РЅРёР№ Рё С„Р°РЅРґСЂР°Р№Р·РёРЅРіР°,https://ru.wordpress.org/plugins/give/,"РџСЂРёРЅРёРјР°Р№С‚Рµ РїРѕР¶РµСЂС‚РІРѕРІР°РЅРёСЏ Рё РЅР°С‡РёРЅР°Р№С‚Рµ СЃР±РѕСЂ СЃСЂРµРґСЃС‚РІ СЃ РїРѕРјРѕС‰СЊСЋ GiveWP, РїР»Р°РіРёРЅР° РґР»СЏ РїРѕР¶РµСЂС‚РІРѕРІР°РЅРёР№ WordPress СЃ СЃР°РјС‹Рј РІС‹СЃРѕРєРёРј СЂРµР№С‚РёРЅРіРѕРј РґР»СЏ РѕРЅР»Р°Р№РЅ РїРѕР¶РµСЂС‚РІРѕРІР°РЅРёР№.",100В 000+ Р°РєС‚РёРІРЅС‹С… СѓСЃС‚Р°РЅРѕРІРѕРє,6.8.1"Feeds for YouTube (РїР»Р°РіРёРЅ РґР»СЏ РІРёРґРµРѕ, РєР°РЅР°Р»Р° Рё РіР°Р»РµСЂРµРё YouTube)",https://ru.wordpress.org/plugins/feeds-for-youtube/,РџР»Р°РіРёРЅ Feeds for YouTube РїРѕР·РІРѕР»СЏРµС‚ РѕС‚РѕР±СЂР°Р¶Р°С‚СЊ РЅР°СЃС‚СЂР°РёРІР°РµРјС‹Рµ Р»РµРЅС‚С‹ YouTube СЃ Р»СЋР±РѕРіРѕ РєР°РЅР°Р»Р° YouTube.,100В 000+ Р°РєС‚РёРІРЅС‹С… СѓСЃС‚Р°РЅРѕРІРѕРє,6.8.1Schema & Structured Data for WP & AMP,https://ru.wordpress.org/plugins/schema-and-structured-data-for-wp/,Schema & Structured Data adds Google Rich Snippets markup according to Schema.org guidelines to structure your site for SEO.,100В 000+ Р°РєС‚РёРІРЅС‹С… СѓСЃС‚Р°РЅРѕРІРѕРє,6.8.1LuckyWP Table of Contents,https://ru.wordpress.org/plugins/luckywp-table-of-contents/,"РЎРѕР·РґР°С‘С‚ SEO-РґСЂСѓР¶РµСЃС‚РІРµРЅРЅРѕРµ СЃРѕРґРµСЂР¶Р°РЅРёРµ РґР»СЏ РІР°С€РёС… РїРѕСЃС‚РѕРІ/СЃС‚СЂР°РЅРёС†. Р Р°Р±РѕС‚Р°РµС‚ Р°РІС‚РѕРјР°С‚РёС‡РµСЃРєРё РёР»Рё РІСЂСѓС‡РЅСѓСЋ (С‡РµСЂРµР· С€РѕСЂС‚РєРѕРґ, Gutenberg-Р±Р»РѕРє РёР»Рё РІРёРґР¶РµС‚).",100В 000+ Р°РєС‚РёРІРЅС‹С… СѓСЃС‚Р°РЅРѕРІРѕРє,6.7.2Pods вЂ” Custom Content Types and Fields,https://ru.wordpress.org/plugins/pods/,"Pods вЂ” СЌС‚Рѕ РїР»Р°С‚С„РѕСЂРјР° РґР»СЏ СЃРѕР·РґР°РЅРёСЏ, СѓРїСЂР°РІР»РµРЅРёСЏ Рё СЂР°Р·РІРµСЂС‚С‹РІР°РЅРёСЏ РЅР°СЃС‚СЂР°РёРІР°РµРјС‹С… С‚РёРїРѕРІ РєРѕРЅС‚РµРЅС‚Р° Рё РїРѕР»РµР№ РґР»СЏ Р»СЋР±РѕРіРѕ РїСЂРѕРµРєС‚Р°.",100В 000+ Р°РєС‚РёРІРЅС‹С… СѓСЃС‚Р°РЅРѕРІРѕРє,6.8.1"EmbedPress вЂ“ PDF Embedder PDF 3D FlipBook, Social Feeds, Google Docs, Vimeo, Wistia, YouTube Videos, Maps Embed & Upload PDF Documents",https://ru.wordpress.org/plugins/embedpress/,"EmbedPress lets you embed videos, pages, social feeds, embed PDF 3D flipbooks & other content on WordPress without coding & enhance storytelling.",100В 000+ Р°РєС‚РёРІРЅС‹С… СѓСЃС‚Р°РЅРѕРІРѕРє,6.8.1Social Р—РЅР°С‡РєРё & Sharing Buttons by WPZOOM,https://ru.wordpress.org/plugins/social-icons-widget-by-wpzoom/,Add social media icons and sharing buttons to your website! Social Р—РЅР°С‡РєРё & Sharing Buttons includes 400+ icons and customizable sharing buttons.,100В 000+ Р°РєС‚РёРІРЅС‹С… СѓСЃС‚Р°РЅРѕРІРѕРє,6.8.1"Hustle вЂ” Email Marketing, Lead Generation, Optins, Popups",https://ru.wordpress.org/plugins/wordpress-popup/,"Setup email optin forms, popups, newsletter forms & subscription forms to generate email leads with the best marketing popup builder",100В 000+ Р°РєС‚РёРІРЅС‹С… СѓСЃС‚Р°РЅРѕРІРѕРє,6.8.1Web Stories,https://ru.wordpress.org/plugins/web-stories/,"Web Stories вЂ” СЌС‚Рѕ РІРёР·СѓР°Р»СЊРЅС‹Рµ РёСЃС‚РѕСЂРёРё РґР»СЏ РІР°С€РµРіРѕ СЃР°Р№С‚Р° СЃ Р±С‹СЃС‚СЂРѕР№ Р·Р°РіСЂСѓР·РєРѕР№ Рё РїРѕР»РЅРѕСЌРєСЂР°РЅРЅС‹Рј СЂРµР¶РёРјРѕРј, РїРѕРіСЂСѓР¶Р°СЋС‰РёРµ РІР°С€РёС… С‡РёС‚Р°С‚РµР»РµР№ РІ РЅР°СЃС‹С€РµРЅРЅС‹Р№ РєРѕРЅС‚РµРЅС‚ РІР°С€РёС… РёСЃС‚РѕСЂРёР№.",90В 000+ Р°РєС‚РёРІРЅС‹С… СѓСЃС‚Р°РЅРѕРІРѕРє,6.8.1Event Tickets and Registration,https://ru.wordpress.org/plugins/event-tickets/,Event Tickets РїРѕР·РІРѕР»СЏРµС‚ РІР°С€РёРј РїРѕСЃРµС‚РёС‚РµР»СЏРј СЂРµРіРёСЃС‚СЂРёСЂРѕРІР°С‚СЊСЃСЏ Рё РїРѕРєСѓРїР°С‚СЊ Р±РёР»РµС‚С‹ РЅР° РјРµСЂРѕРїСЂРёСЏС‚РёСЏ РЅР° РІР°С€РµРј СЃР°Р№С‚Рµ. РўР°РєР¶Рµ СЂР°Р±РѕС‚Р°РµС‚ СЃ Events Calendar (РєР°Р»РµРЅРґР°СЂСЊ РјРµСЂРѕРїСЂРёСЏС‚РёР№).,90В 000+ Р°РєС‚РёРІРЅС‹С… СѓСЃС‚Р°РЅРѕРІРѕРє,6.8.1Site Reviews,https://ru.wordpress.org/plugins/site-reviews/,"Site Reviews is a complete review management solution for your website that is designed to work in a similar way to Amazon, Tripadvisor, and Yelp.",70В 000+ Р°РєС‚РёРІРЅС‹С… СѓСЃС‚Р°РЅРѕРІРѕРє,6.8.1"Superb Addons: Blocks, Patterns & Theme Designer",https://ru.wordpress.org/plugins/superb-blocks/,"Create beautiful WordPress websites easily with 10+ blocks, 200+ patterns, 100+ pre-built pages, animations and Theme Designer. No coding needed!",60В 000+ Р°РєС‚РёРІРЅС‹С… СѓСЃС‚Р°РЅРѕРІРѕРє,6.8.1Qi Blocks,https://ru.wordpress.org/plugins/qi-blocks/,Qi Blocks is the largest collection of Gutenberg blocks developed by Qode Interactive.,60В 000+ Р°РєС‚РёРІРЅС‹С… СѓСЃС‚Р°РЅРѕРІРѕРє,6.8.1"User Profile Builder вЂ” Beautiful User Registration Forms, User Profiles & User Role Editor",https://ru.wordpress.org/plugins/profile-builder/,"Powerful user profile plugin to create front-end user registration forms, login & user profile forms. Includes user role editor & content restriction.",50В 000+ Р°РєС‚РёРІРЅС‹С… СѓСЃС‚Р°РЅРѕРІРѕРє,6.8.1Getwid вЂ”  Р‘Р»РѕРєРё Gutenberg,https://ru.wordpress.org/plugins/getwid/,"40+ Р±Р»РѕРєРѕРІ РґР»СЏ СЂРµРґР°РєС‚РѕСЂР° Gutenberg, Р° С‚Р°РєР¶Рµ РЅРµСЃРєРѕР»СЊРєРѕ РіРѕС‚РѕРІС‹С… Р±РµСЃРїР»Р°С‚РЅС‹С… С€Р°Р±Р»РѕРЅРѕРІ-Р±Р»РѕРєРѕРІ РґР»СЏ СЂРµРґР°РєС‚РѕСЂР° Р±Р»РѕРєРѕРІ WordPress.",50В 000+ Р°РєС‚РёРІРЅС‹С… СѓСЃС‚Р°РЅРѕРІРѕРє,6.8.1Booking Calendar,https://ru.wordpress.org/plugins/booking/,"Original ""Booking Calendar"" plugin. Easily manage full-day bookings, time-slot appointments, or events in our all-in-one, outstanding booking system.",50В 000+ Р°РєС‚РёРІРЅС‹С… СѓСЃС‚Р°РЅРѕРІРѕРє,6.8.1Ultimate Blocks вЂ” РџР»Р°РіРёРЅ Р±Р»РѕРєРѕРІ WordPress,https://ru.wordpress.org/plugins/ultimate-blocks/,Create Better Content With The Block Editor. Custom Blocks for Bloggers and Content Marketers.,50В 000+ Р°РєС‚РёРІРЅС‹С… СѓСЃС‚Р°РЅРѕРІРѕРє,6.8.1User Profile Picture,https://ru.wordpress.org/plugins/metronet-profile-picture/,РЈСЃС‚Р°РЅРѕРІРёС‚Рµ РїРѕР»СЊР·РѕРІР°С‚РµР»СЊСЃРєРѕРµ РёР·РѕР±СЂР°Р¶РµРЅРёРµ РїСЂРѕС„РёР»СЏ (Р°РІР°С‚Р°СЂ) РґР»СЏ РїРѕР»СЊР·РѕРІР°С‚РµР»СЏ СЃ РїРѕРјРѕС‰СЊСЋ СЃС‚Р°РЅРґР°СЂС‚РЅРѕРіРѕ РёРЅСЃС‚СЂСѓРјРµРЅС‚Р° Р·Р°РіСЂСѓР·РєРё РјСѓР»СЊС‚РёРјРµРґРёР° WordPress.,50В 000+ Р°РєС‚РёРІРЅС‹С… СѓСЃС‚Р°РЅРѕРІРѕРє,6.6.2WP Recipe Maker,https://ru.wordpress.org/plugins/wp-recipe-maker/,РџСЂРѕСЃС‚РѕР№ Рё СѓРґРѕР±РЅС‹Р№ РїР»Р°РіРёРЅ СЂРµС†РµРїС‚РѕРІ РґР»СЏ РІСЃРµС…. РђРІС‚РѕРјР°С‚РёС‡РµСЃРєРёРµ РјРµС‚Р°РґР°РЅРЅС‹Рµ JSON-LD РјРµС‚Р°РґР°РЅРЅС‹Рµ РґР»СЏ РµРґС‹ Рё СЂРµС†РµРїС‚РѕРІ СѓР»СѓС‡С€Р°С‚ РІР°С€Рµ SEO!,50В 000+ Р°РєС‚РёРІРЅС‹С… СѓСЃС‚Р°РЅРѕРІРѕРє,6.8.1Calculated Fields Form,https://ru.wordpress.org/plugins/calculated-fields-form/,The CFF plugin allows you to create both simple and professional forms. Its form builder includes dynamic calculated fields and many other controls.,50В 000+ Р°РєС‚РёРІРЅС‹С… СѓСЃС‚Р°РЅРѕРІРѕРє,6.8.1"RSS Aggregator by Feedzy вЂ“ Feed to Post, Autoblogging, News & YouTube Video Feeds Aggregator",https://ru.wordpress.org/plugins/feedzy-rss-feeds/,"The most powerful WordPress RSS aggregator, helping you curate content, autoblog, import RSS & display unlimited RSS feeds within a few minutes.",50В 000+ Р°РєС‚РёРІРЅС‹С… СѓСЃС‚Р°РЅРѕРІРѕРє,6.8.1"Kit (formerly ConvertKit) вЂ” Email Newsletter, Email Marketing, Subscribers and Landing Pages",https://ru.wordpress.org/plugins/convertkit/,"Build your email subscriber lists, send email marketing newsletters, sell more products and build your membership site with Kit (formerly ConvertKit).",40В 000+ Р°РєС‚РёРІРЅС‹С… СѓСЃС‚Р°РЅРѕРІРѕРє,6.8.1"Photo Gallery, Images, Slider in Rbs Image Gallery",https://ru.wordpress.org/plugins/robo-gallery/,Rbs Image Gallery is a powerful image gallery and photo gallery plugin with advanced features to create responsive galleries with a beautiful lightbox,40В 000+ Р°РєС‚РёРІРЅС‹С… СѓСЃС‚Р°РЅРѕРІРѕРє,6.8.1Form Maker by 10Web вЂ” РЈРґРѕР±РЅС‹Р№ РґР»СЏ РјРѕР±РёР»СЊРЅС‹С… СѓСЃС‚СЂРѕР№СЃС‚РІ РєРѕРЅСЃС‚СЂСѓРєС‚РѕСЂ РєРѕРЅС‚Р°РєС‚РЅС‹С… С„РѕСЂРј СЃ РїРµСЂРµС‚Р°СЃРєРёРІР°РЅРёРµРј,https://ru.wordpress.org/plugins/form-maker/,"Form Maker вЂ” СЌС‚Рѕ СѓРґРѕР±РЅС‹Р№ РєРѕРЅСЃС‚СЂСѓРєС‚РѕСЂ РєРѕРЅС‚Р°РєС‚РЅС‹С… С„РѕСЂРј, РєРѕС‚РѕСЂС‹Р№ РїРѕР·РІРѕР»СЏРµС‚ СЃРѕР·РґР°РІР°С‚СЊ С„РѕСЂРјС‹ РґР»СЏ Р»СЋР±С‹С… С†РµР»РµР№, РѕС‚ РїСЂРѕСЃС‚РѕР№ С„РѕСЂРјС‹ РєРѕРЅС‚Р°РєС‚Р° РґРѕ РјРЅРѕРіРѕСЃС‚СЂР°РЅРёС‡РЅС‹С… С„РѕСЂРј РѕРїСЂРѕСЃР°.",40В 000+ Р°РєС‚РёРІРЅС‹С… СѓСЃС‚Р°РЅРѕРІРѕРє,6.8.1Genesis Blocks,https://ru.wordpress.org/plugins/genesis-blocks/,"A collection of content blocks, sections, & full-page layouts for the block editor.",40В 000+ Р°РєС‚РёРІРЅС‹С… СѓСЃС‚Р°РЅРѕРІРѕРє,6.6.2"Post Grid Gutenberg Blocks for News, Magazines, Blog Websites вЂ” PostX",https://ru.wordpress.org/plugins/ultimate-post/,"A highly customizable plugin to create news, magazines, and any kind of blog site with post grid, post filter, post slider, and post blocks.",40В 000+ Р°РєС‚РёРІРЅС‹С… СѓСЃС‚Р°РЅРѕРІРѕРє,6.8.1"Gallery Blocks with Lightbox. Image Gallery, (HTML5 video , YouTube, Vimeo) Video Gallery and Lightbox for native gallery",https://ru.wordpress.org/plugins/simply-gallery-block/,"Р”РІР° РІ РѕРґРЅРѕРј. Р‘Р»РѕРєРё РіР°Р»РµСЂРµРё Gutenberg (Masonry, Justified, Slider, Carousel, Grid) Рё РЅР°СЃС‚СЂР°РёРІР°РµРјС‹Р№ Р»Р°Р№С‚Р±РѕРєСЃ.",40В 000+ Р°РєС‚РёРІРЅС‹С… СѓСЃС‚Р°РЅРѕРІРѕРє,6.8.1РЎР»Р°Р№РґРµСЂ РѕС‚ Soliloquy вЂ” Р°РґР°РїС‚РёРІРЅС‹Р№ СЃР»Р°Р№РґРµСЂ РёР·РѕР±СЂР°Р¶РµРЅРёР№ РґР»СЏ WordPress,https://ru.wordpress.org/plugins/soliloquy-lite/,"Р›СѓС‡С€РёР№ РїР»Р°РіРёРЅ WordPress РґР»СЏ СЃР»Р°Р№РґРµСЂРѕРІ. РљРѕРЅСЃС‚СЂСѓРєС‚РѕСЂ Р°РґР°РїС‚РёРІРЅС‹С… СЃР»Р°Р№РґРµСЂРѕРІ СЃ С„СѓРЅРєС†РёРµР№ РїРµСЂРµС‚Р°СЃРєРёРІР°РЅРёСЏ, СЃ РєРѕС‚РѕСЂС‹Рј РІСЃРµРіРѕ РїР°СЂРѕР№ С‰РµР»С‡РєРѕРІ РјС‹С€СЊСЋ РІС‹ СЃРјРѕР¶РµС‚Рµ СЃРѕР·РґР°РІР°С‚СЊ РєСЂР°СЃРёРІС‹Рµ СЃР»Р°Р№Рґ-С€РѕСѓ.",40В 000+ Р°РєС‚РёРІРЅС‹С… СѓСЃС‚Р°РЅРѕРІРѕРє,6.6.2Gutentor вЂ” Gutenberg Blocks вЂ” Page Builder for Gutenberg Editor,https://ru.wordpress.org/plugins/gutentor/,"Advanced yet easy, Gutenberg editor page builder blocks. Create a masterpiece, pixel perfect website using modern WordPress Gutenberg blocks.",30В 000+ Р°РєС‚РёРІРЅС‹С… СѓСЃС‚Р°РЅРѕРІРѕРє,6.8.1Timetable and Event Schedule by MotoPress,https://ru.wordpress.org/plugins/mp-timetable/,РЈРјРЅС‹Р№ РѕСЂРіР°РЅРёР·Р°С‚РѕСЂ Рё С‚Р°Р№Рј-РјРµРЅРµРґР¶РјРµРЅС‚ РёРЅСЃС‚СЂСѓРјРµРЅС‚ СЃ С‡РёСЃС‚С‹Рј РјРёРЅРёРјР°Р»РёСЃС‚РёС‡РЅС‹Рј РґРёР·Р°Р№РЅРѕРј РґР»СЏ РІС‹РІРѕРґР° СЂР°СЃРїРёСЃР°РЅРёР№ РїСЂРµРґСЃС‚РѕСЏС‰РёС… СЃРѕР±С‹С‚РёР№.,30В 000+ Р°РєС‚РёРІРЅС‹С… СѓСЃС‚Р°РЅРѕРІРѕРє,6.7.2"ThirstyAffiliates вЂ” Affiliate Links, Link Branding, Link Tracking & Marketing Plugin",https://ru.wordpress.org/plugins/thirstyaffiliates/,"рџ”— Affiliate link management & cloaker tool. Easily manage, shrink and track your affiliate links in WordPress. рџ”Ґ",30В 000+ Р°РєС‚РёРІРЅС‹С… СѓСЃС‚Р°РЅРѕРІРѕРє,6.8.1Carousel Slider Block for Gutenberg,https://ru.wordpress.org/plugins/carousel-block/,A responsive carousel slider for the Gutenberg editor that supports adding any blocks to slides.,30В 000+ Р°РєС‚РёРІРЅС‹С… СѓСЃС‚Р°РЅРѕРІРѕРє,6.8.1"Advanced Responsive Video Embedder for Rumble, Odysee, YouTube, Vimeo, Kick вЂ¦",https://ru.wordpress.org/plugins/advanced-responsive-video-embedder/,"Level up your basic video embeds! Advanced features, privacy. Use URLs, Shortcodes or Blocks to customize videos to your needs.",30В 000+ Р°РєС‚РёРІРЅС‹С… СѓСЃС‚Р°РЅРѕРІРѕРє,6.8.1Uncanny Toolkit for LearnDash,https://ru.wordpress.org/plugins/uncanny-learndash-toolkit/,Extend LearnDash with a variety of useful modules that make it even easier to build great learner experiences with LearnDash.,30В 000+ Р°РєС‚РёРІРЅС‹С… СѓСЃС‚Р°РЅРѕРІРѕРє,6.8.1Portfolio Gallery вЂ” РџР»Р°РіРёРЅ РіР°Р»РµСЂРµРё РёР·РѕР±СЂР°Р¶РµРЅРёР№,https://ru.wordpress.org/plugins/portfolio-filter-gallery/,"Portfolio gallery РёРјРµРµС‚ РѕС‚РґРµР»СЊРЅСѓСЋ СЃС‚СЂР°РЅРёС†Сѓ РєР°С‚РµРіРѕСЂРёР№ Рё СѓРґРѕР±РЅС‹Р№ РёРЅС‚РµСЂС„РµР№СЃ. Р’РёС‚СЂРёРЅР° РїРѕСЂС‚С„РѕР»РёРѕ, РёР·РѕР±СЂР°Р¶РµРЅРёСЏ, РІРёРґРµРѕ, РіР°Р»РµСЂРµСЏ.",30В 000+ Р°РєС‚РёРІРЅС‹С… СѓСЃС‚Р°РЅРѕРІРѕРє,6.8.1"Gutenberg Blocks вЂ” PublishPress Blocks Controls, Visibility, Reusable Blocks",https://ru.wordpress.org/plugins/advanced-gutenberg/,"PublishPress Blocks include accordions, tables, tabs, and more. Plus it has block controls for visibility, devices, user roles.",30В 000+ Р°РєС‚РёРІРЅС‹С… СѓСЃС‚Р°РЅРѕРІРѕРє,6.8.1Quiz Maker,https://ru.wordpress.org/plugins/quiz-maker/,"РџР»Р°РіРёРЅ QUIZ MAKER РїРѕР·РІРѕР»СЏРµС‚ СЃРѕР·РґР°С‚СЊ Рё РїСЂРѕРІРѕРґРёС‚СЊ РЅРµРѕРіСЂР°РЅРёС‡РµРЅРЅРѕРµ РєРѕР»РёС‡РµСЃС‚РІРѕ РІРёРєС‚РѕСЂРёРЅ, СЌРєР·Р°РјРµРЅРѕРІ Рё С‚РµСЃС‚РѕРІ.",30В 000+ Р°РєС‚РёРІРЅС‹С… СѓСЃС‚Р°РЅРѕРІРѕРє,6.8.1Visualizer: Tables and Charts Manager for WordPress,https://ru.wordpress.org/plugins/visualizer/,"A simple yet powerful WordPress chart plugin to effortlessly create and embed responsive charts & tables into your site, supporting multiple data  вЂ¦",20В 000+ Р°РєС‚РёРІРЅС‹С… СѓСЃС‚Р°РЅРѕРІРѕРє,6.8.1Constant Contact Forms,https://ru.wordpress.org/plugins/constant-contact-forms/,РћС„РёС†РёР°Р»СЊРЅС‹Р№ РїР»Р°РіРёРЅ Constant Contact РґРѕР±Р°РІР»СЏРµС‚ РЅР° РІР°С€ СЃР°Р№С‚ WordPress РєРѕРЅС‚Р°РєС‚РЅСѓСЋ С„РѕСЂРјСѓ РґР»СЏ Р±С‹СЃС‚СЂРѕРіРѕ СЃР±РѕСЂР° РёРЅС„РѕСЂРјР°С†РёРё РѕС‚ РїРѕСЃРµС‚РёС‚РµР»РµР№.,20В 000+ Р°РєС‚РёРІРЅС‹С… СѓСЃС‚Р°РЅРѕРІРѕРє,6.8.1Snow Monkey Editor,https://ru.wordpress.org/plugins/snow-monkey-editor/,The Snow Monkey Editor is a plugin that extends the block editor.,20В 000+ Р°РєС‚РёРІРЅС‹С… СѓСЃС‚Р°РЅРѕРІРѕРє,6.8.1"Happyforms вЂ” Form Builder for WordPress: Drag & Drop Contact Forms, Surveys, Payments & Multipurpose Forms",https://ru.wordpress.org/plugins/happyforms/,"Best WordPress contact form, newsletter form and payment form builder without the sucky stuff вЂ” lost emails, pesky spam, leaky privacy and outsourced  вЂ¦",20В 000+ Р°РєС‚РёРІРЅС‹С… СѓСЃС‚Р°РЅРѕРІРѕРє,6.8.1Cool Timeline (Horizontal & Vertical Timeline),https://ru.wordpress.org/plugins/cool-timeline/,"Showcase your story or company history, events, and roadmap in a precise and elegant way using the powerful Cool Timeline plugin.",20В 000+ Р°РєС‚РёРІРЅС‹С… СѓСЃС‚Р°РЅРѕРІРѕРє,6.8.1Accept Stripe Payments,https://ru.wordpress.org/plugins/stripe-payments/,Easily accept payments on your WordPress site via Stripe payment gateway.,20В 000+ Р°РєС‚РёРІРЅС‹С… СѓСЃС‚Р°РЅРѕРІРѕРє,6.8.1"Toolkit for Block Theme (Starter Templates, Portfolio, Gutenberg Blocks, Patterns) вЂ“ Twentig",https://ru.wordpress.org/plugins/twentig/,"Create your website with starter templates, portfolio features, enhanced Gutenberg blocks & patterns. Boost Twenty Twenty-Five or any block theme.",20В 000+ Р°РєС‚РёРІРЅС‹С… СѓСЃС‚Р°РЅРѕРІРѕРє,6.8.1Ecwid by Lightspeed Ecommerce Shopping Cart,https://ru.wordpress.org/plugins/ecwid-shopping-cart/,"Powerful, easy to use ecommerce shopping cart for WordPress. РџСЂРѕРґР°Р¶Рё РІ СЃРѕС†СЃРµС‚СЏС…. iPhone & Android apps. Superb support.",20В 000+ Р°РєС‚РёРІРЅС‹С… СѓСЃС‚Р°РЅРѕРІРѕРє,6.8.1WP Map Block вЂ” Р‘Р»РѕРє РєР°СЂС‚ Gutenberg РґР»СЏ РєР°СЂС‚ Google Рё OpenStreet Map by aBlocks,https://ru.wordpress.org/plugins/wp-map-block/,Р”Р»СЏ Р·Р°РїСѓСЃРєР° Google Maps Рё OpenStreetMap РєР»СЋС‡ API РЅРµ С‚СЂРµР±СѓРµС‚СЃСЏ.,20В 000+ Р°РєС‚РёРІРЅС‹С… СѓСЃС‚Р°РЅРѕРІРѕРє,6.8.1WPZOOM Portfolio Lite вЂ” Filterable Portfolio Plugin,https://ru.wordpress.org/plugins/wpzoom-portfolio/,The Ultimate WordPress Portfolio Plugin to Showcase Your Work in Style,20В 000+ Р°РєС‚РёРІРЅС‹С… СѓСЃС‚Р°РЅРѕРІРѕРє,6.8.1SyntaxHighlighter Evolved,https://ru.wordpress.org/plugins/syntaxhighlighter/,Easily post syntax-highlighted code to your site without having to modify the code at all. As seen on WordPress.com.,20В 000+ Р°РєС‚РёРІРЅС‹С… СѓСЃС‚Р°РЅРѕРІРѕРє,6.7.2Embed PDF Viewer,https://ru.wordpress.org/plugins/embed-pdf-viewer/,Embed a PDF from the Media Library or elsewhere via oEmbed or as a block into an iframe tag.,20В 000+ Р°РєС‚РёРІРЅС‹С… СѓСЃС‚Р°РЅРѕРІРѕРє,6.7.2Reusable Blocks Extended,https://ru.wordpress.org/plugins/reusable-blocks-extended/,"Р Р°СЃС€РёСЂСЊС‚Рµ С„СѓРЅРєС†РёРѕРЅР°Р» РјРЅРѕРіРѕСЂР°Р·РѕРІС‹С… Р±Р»РѕРєРѕРІ Gutenberg СЃ РїРѕРјРѕС‰СЊСЋ РїРѕР»РЅРѕС†РµРЅРЅРѕР№ РїР°РЅРµР»Рё Р°РґРјРёРЅРёСЃС‚СЂР°С‚РѕСЂР°, РІРёРґР¶РµС‚РѕРІ, С€РѕСЂС‚РєРѕРґРѕРІ Рё С„СѓРЅРєС†РёР№ PHP.",20В 000+ Р°РєС‚РёРІРЅС‹С… СѓСЃС‚Р°РЅРѕРІРѕРє,6.8.1