Yoast SEO,https://ru.wordpress.org/plugins/wordpress-seo/,Улучшите SEO вашего WordPress: поработайте над качеством контента и получите полностью оптимизированный WordPress-сайт с помощью плагина Yoast SEO.,10+ млн активных установок,6.8.1"WPForms — простой конструктор форм для WordPress — контактные формы, формы оплаты, опросы и многое другое",https://ru.wordpress.org/plugins/wpforms-lite/,"Лучший плагин контактных форм для WordPress. Удобный онлайн-конструктор с функцией перетаскивания, позволяющий создавать красивые контактные формы, формы оплаты и другие произвольные формы.",6+ млн активных установок,6.8.1"Jetpack предназначен для защиты, резервного копирования, повышения скорости работы и развития вашего сайта WordPress",https://ru.wordpress.org/plugins/jetpack/,"Укрепите защиту сайта WordPress с помощью простых, но эффективных инструментов: резервного копирования, WAF и проверки наличия вредоносного ПО. Включает бесплатный доступ к полезным инструментам, в том числе статистике, сети доставки контента и публикации записей в социальных сетях.",4+ млн активных установок,6.8.1Rank Math SEO – Инструменты SEO с ИИ для доминирования в SEO-рейтинге,https://ru.wordpress.org/plugins/seo-by-rank-math/,"Rank Math SEO — лучший WordPress SEO плагин, сочетающий в себе функции многих инструментов SEO и ИИ в одном пакете и помогающий умножать SEO трафик сайта.",3+ млн активных установок,6.8.1Advanced Editor Tools,https://ru.wordpress.org/plugins/tinymce-advanced/,Расширяет и улучшает редактор блоков (Gutenberg) и классический редактор (TinyMCE).,2+ млн активных установок,6.8.1MC4WP: Mailchimp for WordPress,https://ru.wordpress.org/plugins/mailchimp-for-wp/,The #1 Mailchimp plugin for WordPress. Allows you to add a multitude of newsletter sign-up methods to your site.,2+ млн активных установок,6.8.1Complianz — GDPR/CCPA Cookie Consent,https://ru.wordpress.org/plugins/complianz-gdpr/,"Configure your Cookie Banner, Cookie Consent and Cookie Policy with our Wizard and Cookies Scan.",1+ млн активных установок,6.8.1Smush Image Optimization – Optimize Images | Compress & Lazy Load Images | Convert WebP & AVIF | Image CDN,https://ru.wordpress.org/plugins/wp-smushit/,"Optimize images & bulk compress images with lossless compression, lazy load, convert to WebP or AVIF, and properly size images via CDN for incredi …",1+ млн активных установок,6.8.1Smash Balloon Social Photo Feed — удобный плагин для лент социальных сетей,https://ru.wordpress.org/plugins/instagram-feed/,Ранее плагин назывался «Instagram Feed». Аккуратное отображение постов из нескольких учетных записей Instagram в виде настраиваемого и адаптивного потока. Поддерживает встроенные файлы Instagram.,1+ млн активных установок,6.8.1Spectra Gutenberg Blocks – конструктор сайтов для редактора блоков,https://ru.wordpress.org/plugins/ultimate-addons-for-gutenberg/,Повышение пощьности Gutenberg расширенными блоками для ускорения создания сайта WordPress без особых усилий!,1+ млн активных установок,6.8.1Redux Framework,https://ru.wordpress.org/plugins/redux-framework/,"Redux — это простая, действительно расширяемая и полностью адаптируемая структура опций для тем и плагинов WordPress. Он поставляется со встроенной демонстрацией.",1+ млн активных установок,6.8.1Smart Slider 3,https://ru.wordpress.org/plugins/smart-slider-3/,"Плагин адаптивного слайдера для простого создания слайдов в визуальном редакторе. Создавайте красивые слайдеры изображений, слоёв, видео, записей блога и т.д.",900 000+ активных установок,6.8.1Events Calendar,https://ru.wordpress.org/plugins/the-events-calendar/,Events Calendar: плагин календаря №1 для WordPress. Создавайте события (в том числе и виртуальные!) на своем сайте и управляйте ими с помощью данного плагина.,700 000+ активных установок,6.8.1Ninja Forms — The Contact Form Builder That Grows With You,https://ru.wordpress.org/plugins/ninja-forms/,"Конструктор форм WordPress, удобный для новичков. Тащи-и-бросай поля формы, чтобы создать красивые профессиональные контактные формы за считанные минуты.",700 000+ активных установок,6.7.2"Slider, Gallery, and Carousel by MetaSlider — Image Slider, Video Slider",https://ru.wordpress.org/plugins/ml-slider/,"Slider, gallery, carousel plugin for WordPress. Build your image slider, video slider, post slider, YouTube slider, or WooCommerce product slider.",600 000+ активных установок,6.8.1"MailPoet — рассылки, маркетинг и автоматизация электронной почты",https://ru.wordpress.org/plugins/mailpoet/,"Отправляйте прекрасные рассылки из WordPress. Собирайте подписчиков с помощью форм подписки, автоматизируйте письма для WooCommerce, уведомлений о записях в блоге и…",600 000+ активных установок,6.8.1"Forminator Forms – Contact Form, Payment Form & Custom Form Builder",https://ru.wordpress.org/plugins/forminator/,"Лучший плагин для создания форм WordPress. Создавайте контактные формы, формы оплаты и формы заказов с более чем 1000 интеграциями.",600 000+ активных установок,6.8.1Gutenberg Blocks with AI by Kadence WP – Page Builder Features,https://ru.wordpress.org/plugins/kadence-blocks/,"20+ AI-powered Gutenberg Blocks with endless options, enabling top-notch efficiency for high-performance dynamic website creation.",500 000+ активных установок,6.8.1WP Shortcodes Plugin — Shortcodes Ultimate,https://ru.wordpress.org/plugins/shortcodes-ultimate/,Обширная коллекция визуальных компонентов для вашего сайта,500 000+ активных установок,6.8.1AMP,https://ru.wordpress.org/plugins/amp/,Самый простой способ улучшить показатель «Удобство страниц» для всех. Работает на основе AMP.,500 000+ активных установок,6.8.1"Photo Gallery, Sliders, Proofing and Themes — NextGEN Gallery",https://ru.wordpress.org/plugins/nextgen-gallery/,The most popular gallery plugin that lets you create galleries and albums in seconds.,400 000+ активных установок,6.8.1CoBlocks — конструктор страниц Блоки Gutenberg,https://ru.wordpress.org/plugins/coblocks/,"CoBlocks — это набор блоков WordPress для конструктора страниц для Gutenberg, с более чем 10 новыми блоками и настоящим конструктором страниц со строками и столбцами.",400 000+ активных установок,6.8.1Duplicate Post,https://ru.wordpress.org/plugins/copy-delete-posts/,Дублировать запись,300 000+ активных установок,6.8.1"Formidable Forms — Contact Form Plugin, Survey, Quiz, Payment, Calculator Form & Custom Form Builder",https://ru.wordpress.org/plugins/formidable/,"Самый продвинутый плагин для форм WordPress. Выйдите за рамки контактных форм с нашим конструктором форм для опросов, викторин и многого другого.",300 000+ активных установок,6.8.1"Блоки Otter — блоки Gutenberg, конструктор страниц для редактора Gutenberg и FSE",https://ru.wordpress.org/plugins/otter-blocks/,"Quickly create WordPress pages with 20+ blocks, 100+ ready-to-import designs, and advanced editor extensions. It’s website building, Lego-style!",300 000+ активных установок,6.8.1SEOPress — On-site SEO,https://ru.wordpress.org/plugins/wp-seopress/,"SEOPress, простой, быстрый и мощный SEO плагин для WordPress. Повышение рейтинга в поисковых системах, полностью белая этикетка. Теперь с искусственным интеллектом.",300 000+ активных установок,6.8.1Members — Membership & User Role Editor Plugin,https://ru.wordpress.org/plugins/members/,Лучший плагин для управления пользователями WordPress и редактирования ролей пользователей. User Roles & Capabilities позволяет ограничивать доступ к содержимому всего за несколько кликов.,300 000+ активных установок,6.8.1"HubSpot — CRM, Email Marketing, Live Chat, Forms & Analytics",https://ru.wordpress.org/plugins/leadin/,"The CRM, Sales, and Marketing WordPress plugin to grow your business better. Capture, organize, and engage web visitors with free live chat, forms, CR …",300 000+ активных установок,6.7.2"Photo Gallery, Sliders, Proofing and Themes вЂ” NextGEN Gallery",https://ru.wordpress.org/plugins/nextgen-gallery/,The most popular gallery plugin that lets you create galleries and albums in seconds.,400В 000+ Р°РєС‚РёРІРЅС‹С… СѓСЃС‚Р°РЅРѕРІРѕРє,6.8.1CoBlocks вЂ” РєРѕРЅСЃС‚СЂСѓРєС‚РѕСЂ СЃС‚СЂР°РЅРёС† Р‘Р»РѕРєРё Gutenberg,https://ru.wordpress.org/plugins/coblocks/,"CoBlocks вЂ” СЌС‚Рѕ РЅР°Р±РѕСЂ Р±Р»РѕРєРѕРІ WordPress РґР»СЏ РєРѕРЅСЃС‚СЂСѓРєС‚РѕСЂР° СЃС‚СЂР°РЅРёС† РґР»СЏ Gutenberg, СЃ Р±РѕР»РµРµ С‡РµРј 10 РЅРѕРІС‹РјРё Р±Р»РѕРєР°РјРё Рё РЅР°СЃС‚РѕСЏС‰РёРј РєРѕРЅСЃС‚СЂСѓРєС‚РѕСЂРѕРј СЃС‚СЂР°РЅРёС† СЃРѕ СЃС‚СЂРѕРєР°РјРё Рё СЃС‚РѕР»Р±С†Р°РјРё.",400В 000+ Р°РєС‚РёРІРЅС‹С… СѓСЃС‚Р°РЅРѕРІРѕРє,6.8.1Duplicate Post,https://ru.wordpress.org/plugins/copy-delete-posts/,Р”СѓР±Р»РёСЂРѕРІР°С‚СЊ Р·Р°РїРёСЃСЊ,300В 000+ Р°РєС‚РёРІРЅС‹С… СѓСЃС‚Р°РЅРѕРІРѕРє,6.8.1"Formidable Forms вЂ” Contact Form Plugin, Survey, Quiz, Payment, Calculator Form & Custom Form Builder",https://ru.wordpress.org/plugins/formidable/,"РЎР°РјС‹Р№ РїСЂРѕРґРІРёРЅСѓС‚С‹Р№ РїР»Р°РіРёРЅ РґР»СЏ С„РѕСЂРј WordPress. Р’С‹Р№РґРёС‚Рµ Р·Р° СЂР°РјРєРё РєРѕРЅС‚Р°РєС‚РЅС‹С… С„РѕСЂРј СЃ РЅР°С€РёРј РєРѕРЅСЃС‚СЂСѓРєС‚РѕСЂРѕРј С„РѕСЂРј РґР»СЏ РѕРїСЂРѕСЃРѕРІ, РІРёРєС‚РѕСЂРёРЅ Рё РјРЅРѕРіРѕРіРѕ РґСЂСѓРіРѕРіРѕ.",300В 000+ Р°РєС‚РёРІРЅС‹С… СѓСЃС‚Р°РЅРѕРІРѕРє,6.8.1"Р‘Р»РѕРєРё Otter вЂ” Р±Р»РѕРєРё Gutenberg, РєРѕРЅСЃС‚СЂСѓРєС‚РѕСЂ СЃС‚СЂР°РЅРёС† РґР»СЏ СЂРµРґР°РєС‚РѕСЂР° Gutenberg Рё FSE",https://ru.wordpress.org/plugins/otter-blocks/,"Quickly create WordPress pages with 20+ blocks, 100+ ready-to-import designs, and advanced editor extensions. ItвЂ™s website building, Lego-style!",300В 000+ Р°РєС‚РёРІРЅС‹С… СѓСЃС‚Р°РЅРѕРІРѕРє,6.8.1SEOPress вЂ” On-site SEO,https://ru.wordpress.org/plugins/wp-seopress/,"SEOPress, РїСЂРѕСЃС‚РѕР№, Р±С‹СЃС‚СЂС‹Р№ Рё РјРѕС‰РЅС‹Р№ SEO РїР»Р°РіРёРЅ РґР»СЏ WordPress. РџРѕРІС‹С€РµРЅРёРµ СЂРµР№С‚РёРЅРіР° РІ РїРѕРёСЃРєРѕРІС‹С… СЃРёСЃС‚РµРјР°С…, РїРѕР»РЅРѕСЃС‚СЊСЋ Р±РµР»Р°СЏ СЌС‚РёРєРµС‚РєР°. РўРµРїРµСЂСЊ СЃ РёСЃРєСѓСЃСЃС‚РІРµРЅРЅС‹Рј РёРЅС‚РµР»Р»РµРєС‚РѕРј.",300В 000+ Р°РєС‚РёРІРЅС‹С… СѓСЃС‚Р°РЅРѕРІРѕРє,6.8.1Members вЂ” Membership & User Role Editor Plugin,https://ru.wordpress.org/plugins/members/,Р›СѓС‡С€РёР№ РїР»Р°РіРёРЅ РґР»СЏ СѓРїСЂР°РІР»РµРЅРёСЏ РїРѕР»СЊР·РѕРІР°С‚РµР»СЏРјРё WordPress Рё СЂРµРґР°РєС‚РёСЂРѕРІР°РЅРёСЏ СЂРѕР»РµР№ РїРѕР»СЊР·РѕРІР°С‚РµР»РµР№. User Roles & Capabilities РїРѕР·РІРѕР»СЏРµС‚ РѕРіСЂР°РЅРёС‡РёРІР°С‚СЊ РґРѕСЃС‚СѓРї Рє СЃРѕРґРµСЂР¶РёРјРѕРјСѓ РІСЃРµРіРѕ Р·Р° РЅРµСЃРєРѕР»СЊРєРѕ РєР»РёРєРѕРІ.,300В 000+ Р°РєС‚РёРІРЅС‹С… СѓСЃС‚Р°РЅРѕРІРѕРє,6.8.1"HubSpot вЂ” CRM, Email Marketing, Live Chat, Forms & Analytics",https://ru.wordpress.org/plugins/leadin/,"The CRM, Sales, and Marketing WordPress plugin to grow your business better. Capture, organize, and engage web visitors with free live chat, forms, CR вЂ¦",300В 000+ Р°РєС‚РёРІРЅС‹С… СѓСЃС‚Р°РЅРѕРІРѕРє,6.7.2"PrettyLinks вЂ” Affiliate Links, Link Branding, Link Tracking, Marketing and Stripe Payments Plugin",https://ru.wordpress.org/plugins/pretty-link/,"рџЊ  Р›СѓС‡С€РёР№ WordPress РїР»Р°РіРёРЅ РґР»СЏ СѓРїСЂР°РІР»РµРЅРёСЏ СЃСЃС‹Р»РєР°РјРё, Р±СЂРµРЅРґРёРЅРіР°, РѕС‚СЃР»РµР¶РёРІР°РЅРёСЏ, РѕР±РјРµРЅР° Рё РїР»Р°С‚РµР¶РµР№. Р›РµРіРєРѕ СЃРѕР·РґР°РІР°Р№С‚Рµ РєСЂР°СЃРёРІС‹Рµ Рё РѕС‚СЃР»РµР¶РёРІР°РµРјС‹Рµ РєРѕСЂРѕС‚РєРёРµ СЃСЃС‹Р»РєРё. рџ”—",300В 000+ Р°РєС‚РёРІРЅС‹С… СѓСЃС‚Р°РЅРѕРІРѕРє,6.8.1Burst Statistics вЂ” Privacy-Friendly Analytics for WordPress,https://ru.wordpress.org/plugins/burst-statistics/,"Self-hosted, privacy-friendly stats for WordPress. Simple interface, no setup. Get detailed analytics with Burst Statistics.",300В 000+ Р°РєС‚РёРІРЅС‹С… СѓСЃС‚Р°РЅРѕРІРѕРє,6.8.1"Popup Builder вЂ” Create highly converting, mobile friendly marketing popups.",https://ru.wordpress.org/plugins/popup-builder/,"РЈРІРµР»РёС‡СЊС‚Рµ РїСЂРѕРґР°Р¶Рё Рё РєРѕРЅРІРµСЂСЃРёСЋ, РѕРїСЂРµРґРµР»РёС‚Рµ РєСЂСѓРі РїРѕС‚РµРЅС†РёР°Р»СЊРЅС‹С… РїРѕС‚СЂРµР±РёС‚РµР»РµР№ Рё РїРѕР»СѓС‡РёС‚Рµ С…РѕСЂРѕС€РёР№ РїСЂРёР·С‹РІ Рє РґРµР№СЃС‚РІРёСЋ СЃ СѓРјРЅС‹Рј РїР»Р°РіРёРЅРѕРј РІСЃРїР»С‹РІР°СЋС‰РµРіРѕ РѕРєРЅР° РґР»СЏ WordPress.",200В 000+ Р°РєС‚РёРІРЅС‹С… СѓСЃС‚Р°РЅРѕРІРѕРє,6.8.1"Fonts Plugin | Use Google Fonts, Adobe Fonts or Upload Fonts",https://ru.wordpress.org/plugins/olympus-google-fonts/,"The easiest to customize fonts in WordPress. Optimized for Speed. 1000+ font choices. Supports Google Fonts, Adobe Fonts and Upload Fonts.",200В 000+ Р°РєС‚РёРІРЅС‹С… СѓСЃС‚Р°РЅРѕРІРѕРє,6.8.1Photo Gallery by 10Web вЂ” Mobile-Friendly Image Gallery,https://ru.wordpress.org/plugins/photo-gallery/,Photo Gallery вЂ” СЌС‚Рѕ РјРѕС‰РЅС‹Р№ РїР»Р°РіРёРЅ РіР°Р»РµСЂРµРё РёР·РѕР±СЂР°Р¶РµРЅРёР№ СЃРѕ СЃРїРёСЃРєРѕРј СЂР°СЃС€РёСЂРµРЅРЅС‹С… РїР°СЂР°РјРµС‚СЂРѕРІ РґР»СЏ СЃРѕР·РґР°РЅРёСЏ Р°РґР°РїС‚РёРІРЅС‹С… РіР°Р»РµСЂРµР№ РёР·РѕР±СЂР°Р¶РµРЅРёР№ СЃ РєСЂР°СЃРёРІС‹Рј Р»Р°Р№С‚Р±РѕРєСЃРѕРј.,200В 000+ Р°РєС‚РёРІРЅС‹С… СѓСЃС‚Р°РЅРѕРІРѕРє,6.7.2Social Post Feed РѕС‚ Smash Balloon вЂ” РїСЂРѕСЃС‚С‹Рµ Р»РµРЅС‚С‹ СЃРѕС†РёР°Р»СЊРЅС‹С… СЃРµС‚РµР№ РІ WordPress,https://ru.wordpress.org/plugins/custom-facebook-feed/,"Р Р°РЅРµРµ ""Custom Facebook Feed"". РћС‚РѕР±СЂР°Р¶РµРЅРёРµ РїРѕР»РЅРѕСЃС‚СЊСЋ РЅР°СЃС‚СЂР°РёРІР°РµРјС‹С… Р»РµРЅС‚ Facebook СЃРѕ СЃС‚СЂР°РЅРёС† Facebook. РџРѕРґРґРµСЂР¶РёРІР°РµС‚ Facebook oEmbeds.",200В 000+ Р°РєС‚РёРІРЅС‹С… СѓСЃС‚Р°РЅРѕРІРѕРє,6.8.1Orbit Fox РѕС‚ ThemeIsle,https://ru.wordpress.org/plugins/themeisle-companion/,"Р­С‚РѕС‚ РїР»Р°РіРёРЅ С€РІРµР№С†Р°СЂСЃРєРёР№ РЅРѕР¶, РїРѕСЃС‚Р°РІР»СЏРµС‚СЃСЏ СЃ РєР°С‡РµСЃС‚РІРµРЅРЅРѕР№ Р±РёР±Р»РёРѕС‚РµРєРѕР№ С€Р°Р±Р»РѕРЅРѕРІ, РјРѕРґСѓР»СЏРјРё РјРµРЅСЋ/Р·РЅР°С‡РєРѕРІ РѕР±С‰РµРіРѕ РґРѕСЃС‚СѓРїР°, Р±Р»РѕРєР°РјРё Gutenberg Рё РЅРµРґР°РІРЅРѕ РґРѕР±Р°РІР»РµРЅРЅС‹РјРё РІРёРґР¶РµС‚Р°РјРё РєРѕРЅСЃС‚СЂСѓРєС‚РѕСЂР° СЃС‚СЂР°РЅРёС† Elementor/BeaverBuilder РІ РєР°Р¶РґРѕРј РІС‹РїСѓСЃРєРµ.",200В 000+ Р°РєС‚РёРІРЅС‹С… СѓСЃС‚Р°РЅРѕРІРѕРє,6.8.1"Essential Blocks вЂ“ РљРѕРЅСЃС‚СЂСѓРєС‚РѕСЂ СЃС‚СЂР°РЅРёС† Gutenberg РЅР° Р±Р°Р·Рµ РёСЃРєСѓСЃСЃС‚РІРµРЅРЅРѕРіРѕ РёРЅС‚РµР»Р»РµРєС‚Р°: Р±Р»РѕРєРё, С€Р°Р±Р»РѕРЅС‹ Рё С€Р°Р±Р»РѕРЅС‹",https://ru.wordpress.org/plugins/essential-blocks/,"Power up the Gutenberg block editor with AI, 60+ essential blocks, patterns, templates, Woo blocks, post grids, with a robust WordPress block library.",100В 000+ Р°РєС‚РёРІРЅС‹С… СѓСЃС‚Р°РЅРѕРІРѕРє,6.8.1Custom Twitter Feeds вЂ” РІРёРґР¶РµС‚ РґР»СЏ С‚РІРёС‚РѕРІ РёР»Рё РІРёРґР¶РµС‚ РґР»СЏ Р»РµРЅС‚С‹ X,https://ru.wordpress.org/plugins/custom-twitter-feeds/,"РћС‚РѕР±СЂР°Р¶Р°Р№С‚Рµ Р·Р°РїРёСЃРё РёР· СЃРµС‚Рё X (С‚РІРёС‚С‹ РёР· Twitter) РёР· Р»СЋР±РѕР№ РѕР±С‰РµРґРѕСЃС‚СѓРїРЅРѕР№ СѓС‡РµС‚РЅРѕР№ Р·Р°РїРёСЃРё РІ Р°РєРєСѓСЂР°С‚РЅРѕР№ Рё РїСЂРёРІР»РµРєР°С‚РµР»СЊРЅРѕР№ Р»РµРЅС‚Рµ, РєРѕС‚РѕСЂР°СЏ Р±СѓРґРµС‚ РѕР±РЅРѕРІР»СЏС‚СЊСЃСЏ РµР¶РµРЅРµРґРµР»СЊРЅРѕ.",100В 000+ Р°РєС‚РёРІРЅС‹С… СѓСЃС‚Р°РЅРѕРІРѕРє,6.8.1Layout Grid Block,https://ru.wordpress.org/plugins/layout-grid/,РљРѕРЅС‚РµР№РЅРµСЂРЅС‹Р№ Р±Р»РѕРє Gutenberg РїРѕР·РІРѕР»СЏРµС‚ РµРґРёРЅРѕРѕР±СЂР°Р·РЅРѕ РІС‹СЂР°РІРЅРёРІР°С‚СЊ СЌР»РµРјРµРЅС‚С‹ РїРѕ РіР»РѕР±Р°Р»СЊРЅРѕР№ СЃРµС‚РєРµ.,100В 000+ Р°РєС‚РёРІРЅС‹С… СѓСЃС‚Р°РЅРѕРІРѕРє,6.2.6"FooGallery вЂ“ Responsive Photo Gallery, Image Viewer, Justified, Masonry & Carousel",https://ru.wordpress.org/plugins/foogallery/,"Create stunning, SEO optimized galleries using beautiful pre-built templates or advanced settings for complete customization and control.",100В 000+ Р°РєС‚РёРІРЅС‹С… СѓСЃС‚Р°РЅРѕРІРѕРє,6.8.1РџР»Р°РіРёРЅ РіР°Р»РµСЂРµРё РґР»СЏ WordPress вЂ” Envira Photo Gallery,https://ru.wordpress.org/plugins/envira-gallery-lite/,"Envira Gallery вЂ” СЃР°РјР°СЏ Р±С‹СЃС‚СЂР°СЏ, РїСЂРѕСЃС‚Р°СЏ Рё С„СѓРЅРєС†РёРѕРЅР°Р»СЊРЅР°СЏ РіР°Р»РµСЂРµСЏ РёР·РѕР±СЂР°Р¶РµРЅРёР№ РІ WordPress. Р›Р°Р№С‚Р±РѕРєСЃ СЃ РєРѕРЅСЃС‚СЂСѓРєС‚РѕСЂРѕРј СЃ С„СѓРЅРєС†РёРµР№ РїРµСЂРµС‚Р°СЃРєРёРІР°РЅРёСЏ, РєРѕС‚РѕСЂС‹Р№ РїРѕРјРѕР¶РµС‚ РІР°РјвЂ¦",100В 000+ Р°РєС‚РёРІРЅС‹С… СѓСЃС‚Р°РЅРѕРІРѕРє,6.8.1Progress Bar Block,https://ru.wordpress.org/plugins/progress-bar-block/,Gutenberg block development plugin.,РњРµРЅРµРµ 10 Р°РєС‚РёРІРЅС‹С… СѓСЃС‚Р°РЅРѕРІРѕРє,5.0.22Mobile blocks,https://ru.wordpress.org/plugins/mobile-blocks/,"РќСѓР¶РЅР° РїРѕРјРѕС‰СЊ СЃ РјРѕР±РёР»СЊРЅС‹Рј СЃР°Р№С‚РѕРј? РҐРѕС‚РёС‚Рµ, С‡С‚РѕР±С‹ РІР°С€Рё РјРѕР±РёР»СЊРЅС‹Рµ РїРѕСЃРµС‚РёС‚РµР»Рё Р±С‹Р»Рё Р·Р°РёРЅС‚РµСЂРµСЃРѕРІР°РЅС‹? РќСѓР¶РЅРѕ СѓРІРµР»РёС‡РёС‚СЊ РєРѕРЅРІРµСЂСЃРёСЋ РїСЂРѕРґР°Р¶ РІР°С€РµРіРѕ РјР°РіР°Р·РёРЅР°?",РњРµРЅРµРµ 10 Р°РєС‚РёРІРЅС‹С… СѓСЃС‚Р°РЅРѕРІРѕРє,5.9.10Code Snippet Beautifier,https://ru.wordpress.org/plugins/wplp-code-snippet/,This plugin is used for beautify Code Snippet on website.,РњРµРЅРµРµ 10 Р°РєС‚РёРІРЅС‹С… СѓСЃС‚Р°РЅРѕРІРѕРє,5.2.21Melonpan Block вЂ” Post List,https://ru.wordpress.org/plugins/melonpan-block-post-list/,Block that displays a list of selected Posts and Custom post types.,РњРµРЅРµРµ 10 Р°РєС‚РёРІРЅС‹С… СѓСЃС‚Р°РЅРѕРІРѕРє,5.6.14Advanced Archive Blocks,https://ru.wordpress.org/plugins/advanced-archive-blocks/,"Add Archive Block support Yearly, Monthly, Daily, Weekly and Post Type.",РњРµРЅРµРµ 10 Р°РєС‚РёРІРЅС‹С… СѓСЃС‚Р°РЅРѕРІРѕРє,5.0.22HeBo Logo Slider Gutenberg Block,https://ru.wordpress.org/plugins/hebo-logo-slider-block/,Add a simple linkable logo slider to your website,РњРµРЅРµРµ 10 Р°РєС‚РёРІРЅС‹С… СѓСЃС‚Р°РЅРѕРІРѕРє,5.1.19Awesome Alert Blocks,https://ru.wordpress.org/plugins/awesome-alert-blocks/,Awesome Alert Blocks notices for the new WordPress block editor.,РњРµРЅРµРµ 10 Р°РєС‚РёРІРЅС‹С… СѓСЃС‚Р°РЅРѕРІРѕРє,5.0.22Payment Forms CustomBlock,https://ru.wordpress.org/plugins/payment-forms-customblock/,Gutenberg custom block with Stripe Form.,РњРµРЅРµРµ 10 Р°РєС‚РёРІРЅС‹С… СѓСЃС‚Р°РЅРѕРІРѕРє,5.5.15Nested Posts by CurateWP,https://ru.wordpress.org/plugins/curatewp-nested-posts/,Display a list of posts which includes descendants of the current page.,РњРµРЅРµРµ 10 Р°РєС‚РёРІРЅС‹С… СѓСЃС‚Р°РЅРѕРІРѕРє,5.2.21