Survey Maker,https://ru.wordpress.org/plugins/survey-maker/,"РЎРѕР·РґР°РІР°Р№С‚Рµ Р±РµСЃРїР»Р°С‚РЅС‹Рµ РѕРЅР»Р°Р№РЅ-РѕРїСЂРѕСЃС‹ Рё РїСЂРёРІР»РµРєР°Р№С‚Рµ РїРѕСЃРµС‚РёС‚РµР»РµР№, РѕС‚Р·С‹РІС‹ РїСЂСЏРјРѕ РЅР° РІР°С€РµРј РІРµР±-СЃР°Р№С‚Рµ WordPress СЃ РїР»Р°РіРёРЅРѕРј WordPress Survey Plugin",6В 000+ Р°РєС‚РёРІРЅС‹С… СѓСЃС‚Р°РЅРѕРІРѕРє,6.8.1Quiz Cat вЂ” WordPress Quiz Plugin,https://ru.wordpress.org/plugins/quiz-cat/,Quiz Cat Lets You Create Beautiful Viral BuzzFeed-style Quizzes That Drive Social Shares & User Engagement. Set It Up In 2 Minutes.,6В 000+ Р°РєС‚РёРІРЅС‹С… СѓСЃС‚Р°РЅРѕРІРѕРє,6.8.1Countdown Block,https://ru.wordpress.org/plugins/countdown-block/,Highlight Upcoming Events With Countdown Timer with Countdown Block.,6В 000+ Р°РєС‚РёРІРЅС‹С… СѓСЃС‚Р°РЅРѕРІРѕРє,6.6.2iPanorama 360 вЂ” СѓСЃРѕРІРµСЂС€РµРЅСЃС‚РІРѕРІР°РЅРЅС‹Р№ РєРѕРЅСЃС‚СЂСѓРєС‚РѕСЂ РІРёСЂС‚СѓР°Р»СЊРЅС‹С… С‚СѓСЂРѕРІ,https://ru.wordpress.org/plugins/ipanorama-360-virtual-tour-builder-lite/,Let's create virtual tours for your site that empowers your visitors and clients!!! Build a live tour in just a few steps.,6В 000+ Р°РєС‚РёРІРЅС‹С… СѓСЃС‚Р°РЅРѕРІРѕРє,6.8.1Author Avatars List/Block,https://ru.wordpress.org/plugins/author-avatars/,Display lists of user avatars using widgets or shortcodes. With Gutenberg support.,5В 000+ Р°РєС‚РёРІРЅС‹С… СѓСЃС‚Р°РЅРѕРІРѕРє,6.6.2"Payment forms, Buy now buttons, and Invoicing System | GetPaid",https://ru.wordpress.org/plugins/invoicing/,Payments & Invoicing plugin for WordPress to quickly and easily sell online. Create Buy Now buttons or inline checkout forms in seconds to accept  вЂ¦,5В 000+ Р°РєС‚РёРІРЅС‹С… СѓСЃС‚Р°РЅРѕРІРѕРє,6.8.1Product Blocks for WooCommerce,https://ru.wordpress.org/plugins/product-blocks-for-woocommerce/,Product Blocks for WooCommerce helps you create beautiful product display for your products.,5В 000+ Р°РєС‚РёРІРЅС‹С… СѓСЃС‚Р°РЅРѕРІРѕРє,6.7.2"Image Gallery вЂ” Lightbox Gallery, Responsive Photo Gallery, Masonry Gallery",https://ru.wordpress.org/plugins/new-image-gallery/,"The best WordPress image gallery plugin with responsive design, multiple columns, lightbox preview, portfolio & photo gallery features!",5В 000+ Р°РєС‚РёРІРЅС‹С… СѓСЃС‚Р°РЅРѕРІРѕРє,6.7.2Social Media Icons вЂ” Social Icons Widget,https://ru.wordpress.org/plugins/new-social-media-widget/,"Powerful Social Media plugin for WordPress with customizable icons, sizes, styles, animations, responsive settings, rotate effects & widgets.",5В 000+ Р°РєС‚РёРІРЅС‹С… СѓСЃС‚Р°РЅРѕРІРѕРє,6.7.2WP Fusion Lite вЂ” Marketing Automation and CRM Integration for WordPress,https://ru.wordpress.org/plugins/wp-fusion-lite/,WP Fusion Lite synchronizes your WordPress users with contact records in your CRM or marketing automation system.,5В 000+ Р°РєС‚РёРІРЅС‹С… СѓСЃС‚Р°РЅРѕРІРѕРє,6.8.0Album Gallery вЂ” WordPress Gallery,https://ru.wordpress.org/plugins/new-album-gallery/,"Image album, photo album, video album, content gallery: Simplify photo and video album management with responsive lightbox and settings.",5В 000+ Р°РєС‚РёРІРЅС‹С… СѓСЃС‚Р°РЅРѕРІРѕРє,6.7.2Drop Shadow Boxes,https://ru.wordpress.org/plugins/drop-shadow-boxes/,Highlight important content on your posts and pages inside a box with a drop shadow.,5В 000+ Р°РєС‚РёРІРЅС‹С… СѓСЃС‚Р°РЅРѕРІРѕРє,6.7.2Pricing Table вЂ“ Responsive & Easy Pricing Table,https://ru.wordpress.org/plugins/abc-pricing-table/,"Create responsive and customizable pricing tables for WordPress with ease. Shortcodes, templates, and mobile-ready.",5В 000+ Р°РєС‚РёРІРЅС‹С… СѓСЃС‚Р°РЅРѕРІРѕРє,6.8.1Shopping Cart & eCommerce Store,https://ru.wordpress.org/plugins/wp-easycart/,"Р‘Р•РЎРџР›РђРўРќР«Р™ РїР»Р°РіРёРЅ РґР»СЏ WordPress; WordPress Shopping Cart РїР»Р°РіРёРЅ РїРѕР·РІРѕР»СЏРµС‚ РїСЂРѕРґР°РІР°С‚СЊ С‚РѕРІР°СЂС‹, СЃРєР°С‡РёРІР°С‚СЊ, РІРµСЃС‚Рё СЃРµСЂРІРёСЃРЅРѕРµ РѕР±СЃР»СѓР¶РёРІР°РЅРёРµ, СЃРѕР±РёСЂР°С‚СЊ РїРѕР¶РµСЂС‚РІРѕРІР°РЅРёСЏ, Р° С‚Р°РєР¶Рµ РёРјРµРµС‚ РјРЅРѕРіРѕ РґСЂСѓРіРёС… С„СѓРЅРєС†РёР№ СЃ С‚РµС….РїРѕРґРґРµСЂР¶РєРѕР№ online.",4В 000+ Р°РєС‚РёРІРЅС‹С… СѓСЃС‚Р°РЅРѕРІРѕРє,6.8.1Multisite Language Switcher,https://ru.wordpress.org/plugins/multisite-language-switcher/,"A simple, powerful and easy-to-use plugin that will help you to manage multilingual content in a multisite WordPress installation.",4В 000+ Р°РєС‚РёРІРЅС‹С… СѓСЃС‚Р°РЅРѕРІРѕРє,6.8.1Easy Image Collage,https://ru.wordpress.org/plugins/easy-image-collage/,РЎРѕР·РґР°Р№С‚Рµ РєСЂР°СЃРёРІС‹Рµ Р°РґР°РїС‚РёРІРЅС‹Рµ РєРѕР»Р»Р°Р¶Рё РґР»СЏ РІСЃРµС… Р·Р°РїРёСЃРµР№ Рё СЃС‚СЂР°РЅРёС†,4В 000+ Р°РєС‚РёРІРЅС‹С… СѓСЃС‚Р°РЅРѕРІРѕРє,6.8.1Google Maps CP,https://ru.wordpress.org/plugins/codepeople-post-map/,Google Maps CP РїРѕР·РІРѕР»СЏРµС‚ РїСЂРёРІСЏР·С‹РІР°С‚СЊ РёРЅС„РѕСЂРјР°С†РёСЋ Рѕ РіРµРѕР»РѕРєР°С†РёРё Рє РІР°С€РёРј Р·Р°РїРёСЃСЏРј Рё РёРЅС‚РµРіСЂРёСЂРѕРІР°С‚СЊ РІР°С€ Р±Р»РѕРі СЃ Google Maps РїСЂРѕСЃС‚С‹Рј Рё РµСЃС‚РµСЃС‚РІРµРЅРЅС‹Рј СЃРїРѕСЃРѕР±РѕРј.,4В 000+ Р°РєС‚РёРІРЅС‹С… СѓСЃС‚Р°РЅРѕРІРѕРє,6.8.1Responsive Blocks вЂ” WordPress Gutenberg Blocks,https://ru.wordpress.org/plugins/responsive-block-editor-addons/,"Р‘РѕР»РµРµ 50 РєСЂРµР°С‚РёРІРЅС‹С… Р±Р»РѕРєРѕРІ РґР»СЏ СЃРѕР·РґР°РЅРёСЏ РјР°РєРµС‚РѕРІ СЃ Р±РѕРіР°С‚С‹Рј СЃРѕРґРµСЂР¶РёРјС‹Рј РІ СЂРµРґР°РєС‚РѕСЂРµ Gutenberg.
РСЃРїРѕР»СЊР·СѓР№С‚Рµ РїСЂРѕС„РµСЃСЃРёРѕРЅР°Р»СЊРЅС‹Рµ С€Р°Р±Р»РѕРЅС‹ Рё РЅР°С‡Р°Р»СЊРЅС‹Рµ Р±Р»РѕРєРё РґР»СЏ СЃРѕР·РґР°РЅРёСЏ РІРµР±-СЃР°Р№С‚РѕРІ вЂ¦",4В 000+ Р°РєС‚РёРІРЅС‹С… СѓСЃС‚Р°РЅРѕРІРѕРє,6.8.1Custom Related Posts,https://ru.wordpress.org/plugins/custom-related-posts/,Manual related posts without slowing down your website!,4В 000+ Р°РєС‚РёРІРЅС‹С… СѓСЃС‚Р°РЅРѕРІРѕРє,6.8.1Image Gallery Block,https://ru.wordpress.org/plugins/image-gallery-block/,РџСЂРѕРёР·РІРµРґРёС‚Рµ РІРїРµС‡Р°С‚Р»РµРЅРёРµ РЅР° СЃРІРѕСЋ Р°СѓРґРёС‚РѕСЂРёСЋ РєСЂР°СЃРёРІРѕР№ РіР°Р»РµСЂРµРµР№ РёР·РѕР±СЂР°Р¶РµРЅРёР№ СЃ Р»Р°Р№С‚Р±РѕРєСЃР°РјРё.,4В 000+ Р°РєС‚РёРІРЅС‹С… СѓСЃС‚Р°РЅРѕРІРѕРє,6.6.2CP Media Player вЂ” Audio Player and Video Player,https://ru.wordpress.org/plugins/audio-and-video-player/,"CP Media Player вЂ” Audio and Video Player supported by major browsers, such as IE, Firefox, Opera, Safari, Chrome, and mobile devices: iPhone, iPad, An вЂ¦",4В 000+ Р°РєС‚РёРІРЅС‹С… СѓСЃС‚Р°РЅРѕРІРѕРє,6.8.1Browser Screenshots,https://ru.wordpress.org/plugins/browser-shots/,РђРІС‚РѕРјР°С‚РёР·РёСЂСѓР№С‚Рµ РїСЂРѕС†РµСЃСЃ СЃРѕР·РґР°РЅРёСЏ СЃРєСЂРёРЅС€РѕС‚РѕРІ РІРµР±-СЃР°Р№С‚РѕРІ.,4В 000+ Р°РєС‚РёРІРЅС‹С… СѓСЃС‚Р°РЅРѕРІРѕРє,6.5.0"Heroic Glossary вЂ” Block for building Glossaries, Dictionaries and more",https://ru.wordpress.org/plugins/heroic-glossary/,The best WordPress glossary builder plugin to create and manage your own glossary of terms.,4В 000+ Р°РєС‚РёРІРЅС‹С… СѓСЃС‚Р°РЅРѕРІРѕРє,6.7.2"Paymattic вЂ” Secure, Simple Payment & Donation with Subscription Payments, Recurring Donations, Customer Management",https://ru.wordpress.org/plugins/wp-payment-form/,"Create payment form, donate button to accept payments and donations. Manage subscription payment, recurring donation with customer/donor management.",4В 000+ Р°РєС‚РёРІРЅС‹С… СѓСЃС‚Р°РЅРѕРІРѕРє,6.8.1Content Slider Block,https://ru.wordpress.org/plugins/content-slider-block/,Power up your website with the Content Slider Block plugin. Easily create professional sliders using our new block editor integration!,4В 000+ Р°РєС‚РёРІРЅС‹С… СѓСЃС‚Р°РЅРѕРІРѕРє,6.8.1Gutenberg Block for WooCommerce Product Table,https://ru.wordpress.org/plugins/block-for-woo-product-table/,A WordPress editor block which implements the options found in the WooCommerce Product Table shortcode,4В 000+ Р°РєС‚РёРІРЅС‹С… СѓСЃС‚Р°РЅРѕРІРѕРє,6.7.2Tag Groups is the Advanced Way to Display Your Taxonomy Terms,https://ru.wordpress.org/plugins/tag-groups/,"Tag Groups allows you to organize your WordPress taxonomy terms and show them in clouds, tabs, accordions, tables, lists and much more.",4В 000+ Р°РєС‚РёРІРЅС‹С… СѓСЃС‚Р°РЅРѕРІРѕРє,6.8.1"Slider Hero with Video Background, Animation",https://ru.wordpress.org/plugins/slider-hero/,"Hero Slider with Youtube Video Background & Animation Effects. Adverts, Text Carousels, Animated Header вЂ” Elementor Slider Widget & Gutenberg",3В 000+ Р°РєС‚РёРІРЅС‹С… СѓСЃС‚Р°РЅРѕРІРѕРє,6.8.1Chartify вЂ” WordPress Chart Plugin,https://ru.wordpress.org/plugins/chart-builder/,Chartify is a powerful WordPress Chart Builder Plugin that will help you to create WordPress Graphs & Charts easily and quickly.,3В 000+ Р°РєС‚РёРІРЅС‹С… СѓСЃС‚Р°РЅРѕРІРѕРє,6.8.1"Media Slider вЂ” С„РѕС‚РѕСЃР»Р°Р№РґРµСЂ, РІРёРґРµРѕСЃР»Р°Р№РґРµСЂ, СЃР»Р°Р№РґРµСЂ СЃСЃС‹Р»РѕРє, РєР°СЂСѓСЃРµР»СЊРЅРѕРµ СЃР»Р°Р№Рґ-С€РѕСѓ",https://ru.wordpress.org/plugins/media-slider/,"Amazing & easy-to-use WordPress slider plugin. Create responsive image, video, link sliders, thumbnails, carousels & autoplay with ease!",3В 000+ Р°РєС‚РёРІРЅС‹С… СѓСЃС‚Р°РЅРѕРІРѕРє,6.7.2Algori Video and Image Slider,https://ru.wordpress.org/plugins/algori-image-video-slider/,"Algori Video and Image Slider СЌС‚Рѕ РїР»Р°РіРёРЅРѕРІ Р±Р»РѕРєРѕРІ Gutenberg, РєРѕС‚РѕСЂС‹Р№ РїРѕР·РІРѕР»СЏРµС‚ Р»РµРіРєРѕ РґРѕР±Р°РІР»СЏС‚СЊ СЃР»Р°Р№РґРµСЂС‹ РІРёРґРµРѕ Рё РёР·РѕР±СЂР°Р¶РµРЅРёР№ РЅР° РІР°С€ СЃР°Р№С‚.",3В 000+ Р°РєС‚РёРІРЅС‹С… СѓСЃС‚Р°РЅРѕРІРѕРє,6.0.9Forms for Mailchimp by Optin Cat вЂ” Grow Your MailChimp List,https://ru.wordpress.org/plugins/mailchimp-wp/,"Forms for Mailchimp by Optin Cat helps you grow your MailChimp list. Create popups, inline forms, sidebar widgets & more.",3В 000+ Р°РєС‚РёРІРЅС‹С… СѓСЃС‚Р°РЅРѕРІРѕРє,6.8.1Post Layouts for Gutenberg,https://ru.wordpress.org/plugins/post-layouts/,A beautiful post layouts block to showcase your posts in grid and list layout with multiple templates availability.,3В 000+ Р°РєС‚РёРІРЅС‹С… СѓСЃС‚Р°РЅРѕРІРѕРє,6.8.1"Modal Popup Box вЂ” Popup Builder, Show Offers And News in Popup",https://ru.wordpress.org/plugins/modal-popup-box/,"Modal popup box embed anything like image, YouTube & Vimeo videos, image gallery, slider, coupon, offers, plugin shortcodes, forms.",3В 000+ Р°РєС‚РёРІРЅС‹С… СѓСЃС‚Р°РЅРѕРІРѕРє,6.7.2"Slider Responsive Slideshow вЂ” Image slider, Gallery slideshow",https://ru.wordpress.org/plugins/slider-responsive-slideshow/,"Responsive slider plugin for your WordPres website. Carousel, Responsive Image Slider, Photo slider, Slider Gallery.",2В 000+ Р°РєС‚РёРІРЅС‹С… СѓСЃС‚Р°РЅРѕРІРѕРє,6.7.2Grids: Layout builder for WordPress,https://ru.wordpress.org/plugins/grids/,"The most advanced page and layout builder for Gutenberg and the new Block Editor, with columns, rows and responsive controls.",2В 000+ Р°РєС‚РёРІРЅС‹С… СѓСЃС‚Р°РЅРѕРІРѕРє,6.4.5Elfsight Blocks,https://ru.wordpress.org/plugins/elfsight-blocks/,Custom Gutenberg Blocks to embed the Elfsight Widgets.,2В 000+ Р°РєС‚РёРІРЅС‹С… СѓСЃС‚Р°РЅРѕРІРѕРє,6.5.5Email Marketing by EmailOctopus,https://ru.wordpress.org/plugins/emailoctopus/,Official plugin. Allows you to add EmailOctopus subscriber forms to your WordPress site.,2В 000+ Р°РєС‚РёРІРЅС‹С… СѓСЃС‚Р°РЅРѕРІРѕРє,6.8.1YITH Slider for page builders,https://ru.wordpress.org/plugins/yith-slider-for-page-builders/,"""YITH Slider for page Builders"" РґРѕР±Р°РІРёС‚ РЅР° РІР°С€ СЃР°Р№С‚ РєР»Р°СЃСЃРЅС‹Рµ Р±Р»РѕС‡РЅРѕ-РѕСЂРёРµРЅС‚РёСЂРѕРІР°РЅРЅС‹Рµ СЃР»Р°Р№РґРµСЂС‹. Р Р°Р±РѕС‚Р°РµС‚ СЃ СЂРµРґР°РєС‚РѕСЂРѕРј Р±Р»РѕРєРѕРІ Gutenberg.",2В 000+ Р°РєС‚РёРІРЅС‹С… СѓСЃС‚Р°РЅРѕРІРѕРє,6.4.5Social Media Feed вЂ“ Display Instagram Feed on WordPress,https://ru.wordpress.org/plugins/wp-instagram-feed-awplife/,"Display a responsive and customizable Instagram feed gallery on your WordPress site using access token authentication. Supports shortcode, lightbox, l вЂ¦",2В 000+ Р°РєС‚РёРІРЅС‹С… СѓСЃС‚Р°РЅРѕРІРѕРє,6.8.1JVM Gutenberg Rich Text Icons,https://ru.wordpress.org/plugins/jvm-rich-text-icons/,Р”РѕР±Р°РІР»СЏР№С‚Рµ Р·РЅР°С‡РєРё Font Awesome РёР»Рё Р·РЅР°С‡РєРё РёР· РїРѕР»СЊР·РѕРІР°С‚РµР»СЊСЃРєРѕРіРѕ РЅР°Р±РѕСЂР° Р·РЅР°С‡РєРѕРІ РІ РїРѕР»СЏ С„РѕСЂРјР°С‚РёСЂРѕРІР°РЅРЅРѕРіРѕ С‚РµРєСЃС‚Р° РІ Р»СЋР±РѕРј РјРµСЃС‚Рµ СЂРµРґР°РєС‚РѕСЂР° Р±Р»РѕРєРѕРІ Gutenberg!,2В 000+ Р°РєС‚РёРІРЅС‹С… СѓСЃС‚Р°РЅРѕРІРѕРє,6.6.2Super Web Share вЂ” Native Social Sharing Button,https://ru.wordpress.org/plugins/super-web-share/,"Super Web Share helps you easily add a native share prompt to your website, allowing you to share a page or post in less than a minute.",2В 000+ Р°РєС‚РёРІРЅС‹С… СѓСЃС‚Р°РЅРѕРІРѕРє,6.8.1"Animated Live Wall вЂ” Photo Animation, Feed Gallery Image Change Animation",https://ru.wordpress.org/plugins/animated-live-wall/,"Animated live wall gallery creates a dynamic photo wall with animated blocks from Instagram, Flickr, or uploaded media.",2В 000+ Р°РєС‚РёРІРЅС‹С… СѓСЃС‚Р°РЅРѕРІРѕРє,6.7.2"WordPress CRM, Email & Marketing Automation for WordPress | Award Winner вЂ” Groundhogg",https://ru.wordpress.org/plugins/groundhogg/,"Groundhogg is the best WordPress CRM & Marketing Automation plugin. Create flows, email campaigns, and have a CRM all within your WordPress site.",2В 000+ Р°РєС‚РёРІРЅС‹С… СѓСЃС‚Р°РЅРѕРІРѕРє,6.8.1Simple Definition List Blocks,https://ru.wordpress.org/plugins/simple-definition-list-blocks/,РџСЂРѕСЃС‚РѕР№ СЃРїРёСЃРѕРє РѕРїСЂРµРґРµР»РµРЅРёР№.,1В 000+ Р°РєС‚РёРІРЅС‹С… СѓСЃС‚Р°РЅРѕРІРѕРє,6.4.5Di Blocks вЂ” Awesome WordPress Blocks for Gutenberg Editor,https://ru.wordpress.org/plugins/di-blocks/,Di Blocks plugin is a collection of awesome blocks for Gutenberg Editor.,1В 000+ Р°РєС‚РёРІРЅС‹С… СѓСЃС‚Р°РЅРѕРІРѕРє,5.6.14"Video Gallery вЂ“ YouTube API, Vimeo & Link Gallery",https://ru.wordpress.org/plugins/new-video-gallery/,Р’РёРґРµРѕРіР°Р»РµСЂРµСЏ Vimeo/YouTube. РџР»Р°РіРёРЅ РїРѕР·РІРѕР»СЏРµС‚ СЃРѕР·РґР°РІР°С‚СЊ РіР°Р»РµСЂРµРё YouTube Рё Vimeo.,1В 000+ Р°РєС‚РёРІРЅС‹С… СѓСЃС‚Р°РЅРѕРІРѕРє,6.8.1Algori Social Share Buttons,https://ru.wordpress.org/plugins/social-share-buttons-lite/,"Algori Social Share Buttons вЂ” СЌС‚Рѕ Р±Р»РѕС‡РЅС‹Р№ РїР»Р°РіРёРЅ Gutenberg, РєРѕС‚РѕСЂС‹Р№ РїРѕР·РІРѕР»СЏРµС‚ РґРѕР±Р°РІР»СЏС‚СЊ РєРЅРѕРїРєРё В«РџРѕРґРµР»РёС‚СЊСЃСЏ РІ СЃРѕС†РёР°Р»СЊРЅС‹С… СЃРµС‚СЏС…В» РЅР° РІР°С€ РІРµР±-СЃР°Р№С‚.",1В 000+ Р°РєС‚РёРІРЅС‹С… СѓСЃС‚Р°РЅРѕРІРѕРє,6.7.2Countdown Block,https://ru.wordpress.org/plugins/wp-countdown-block/,Create a fear of missing out or urgency on your site or build a coming soon page with Gutenberg Countdown Block.,1В 000+ Р°РєС‚РёРІРЅС‹С… СѓСЃС‚Р°РЅРѕРІРѕРє,5.8.0Infobox,https://ru.wordpress.org/plugins/infobox/,Deliver your content beautifully to grab attention with an animated Infobox block.,1В 000+ Р°РєС‚РёРІРЅС‹С… СѓСЃС‚Р°РЅРѕРІРѕРє,6.6.2"Custom Form Builder, Contact Forms, Payment Forms, Surveys, Polls",https://ru.wordpress.org/plugins/powr-pack/,"The best 60 plugins for WP. Easy contact form plugin, social feed, popup, countdown, and more.",1В 000+ Р°РєС‚РёРІРЅС‹С… СѓСЃС‚Р°РЅРѕРІРѕРє,6.7.2Avatar Privacy,https://ru.wordpress.org/plugins/avatar-privacy/,РџРѕРІС‹СЃСЊС‚Рµ РєРѕРЅС„РёРґРµРЅС†РёР°Р»СЊРЅРѕСЃС‚СЊ РІР°С€РёС… РїРѕР»СЊР·РѕРІР°С‚РµР»РµР№ Рё РїРѕСЃРµС‚РёС‚РµР»РµР№ СЃ РїРѕРјРѕС‰СЊСЋ РіСЂР°РІР°С‚Р°СЂР° Рё Р»РѕРєР°Р»СЊРЅС‹С… Р°РІР°С‚Р°СЂРѕРІ.,1В 000+ Р°РєС‚РёРІРЅС‹С… СѓСЃС‚Р°РЅРѕРІРѕРє,6.2.6CP Contact Form with PayPal,https://ru.wordpress.org/plugins/cp-contact-form-with-paypal/,"PayPal integration for contact forms, payment forms, order forms. Adds a contact form and connect it to a PayPal payment. Official PayPal Partner.",1В 000+ Р°РєС‚РёРІРЅС‹С… СѓСЃС‚Р°РЅРѕРІРѕРє,6.8.1List Last Changes,https://ru.wordpress.org/plugins/list-last-changes/,РћС‚РѕР±СЂР°Р¶РµРЅРёРµ СЃРїРёСЃРєР° РїРѕСЃР»РµРґРЅРёС… РёР·РјРµРЅРµРЅРёР№ РЅР° WordPress-СЃР°Р№С‚Рµ.,1В 000+ Р°РєС‚РёРІРЅС‹С… СѓСЃС‚Р°РЅРѕРІРѕРє,6.8.1"Image Optimizer, Resizer and CDN вЂ” Sirv",https://ru.wordpress.org/plugins/sirv/,"Serve perfectly optimized images, videos, models and 360 spins. The best WordPress & WooCommerce CDN plugin for media.",1В 000+ Р°РєС‚РёРІРЅС‹С… СѓСЃС‚Р°РЅРѕРІРѕРє,6.8.1Mighty Pros & Cons,https://ru.wordpress.org/plugins/mighty-pros-cons/,"Mighty Pros and Cons вЂ” СЌС‚Рѕ Р±Р»РѕРє Gutenberg, РїРѕР·РІРѕР»СЏСЋС‰РёР№ СЃРѕР·РґР°РІР°С‚СЊ Р°РґР°РїС‚РёРІРЅСѓСЋ Рё РїСЂРёРІР»РµРєР°С‚РµР»СЊРЅСѓСЋ С‚Р°Р±Р»РёС†Сѓ РїР»СЋСЃРѕРІ Рё РјРёРЅСѓСЃРѕРІ РЅР° СЃС‚СЂР°РЅРёС†Р°С… СЃР°Р№С‚Р° WordPresshellip;",1В 000+ Р°РєС‚РёРІРЅС‹С… СѓСЃС‚Р°РЅРѕРІРѕРє,6.3.5TWST Login Block,https://ru.wordpress.org/plugins/twst-login-block/,Easily insert a log in block into your post.,1В 000+ Р°РєС‚РёРІРЅС‹С… СѓСЃС‚Р°РЅРѕРІРѕРє,5.5.15MathML Block,https://ru.wordpress.org/plugins/mathml-block/,Р‘Р»РѕРє MathML РґР»СЏ СЂРµРґР°РєС‚РѕСЂР° Р±Р»РѕРєРѕРІ WordPress (Gutenberg).,1В 000+ Р°РєС‚РёРІРЅС‹С… СѓСЃС‚Р°РЅРѕРІРѕРє,6.8.1Enhanced AJAX Add to Cart for WooCommerce,https://ru.wordpress.org/plugins/enhanced-ajax-add-to-cart-for-woocommerce/,"Add variable & other products to cart using a lightweight, smart, and flexible Add to Cart button inline with any content, on any page you desire.",1В 000+ Р°РєС‚РёРІРЅС‹С… СѓСЃС‚Р°РЅРѕРІРѕРє,6.5.5Omnipress,https://ru.wordpress.org/plugins/omnipress/,"A powerful Gutenberg plugin with pre-built patterns, advanced blocks, and demo sites to speed up website creation using Full Site Editing.",1В 000+ Р°РєС‚РёРІРЅС‹С… СѓСЃС‚Р°РЅРѕРІРѕРє,6.8.1Product Slider Block for WooCommerce,https://ru.wordpress.org/plugins/woo-product-slider-block/,Simple slider that slides your woocommerce Products,1В 000+ Р°РєС‚РёРІРЅС‹С… СѓСЃС‚Р°РЅРѕРІРѕРє,5.2.21WP Time Slots Booking Form,https://ru.wordpress.org/plugins/wp-time-slots-booking-form/,WP Time Slots Booking Form СЃРѕР·РґР°РµС‚ С„РѕСЂРјС‹ Р±СЂРѕРЅРёСЂРѕРІР°РЅРёСЏ РґР»СЏ Р±СЂРѕРЅРёСЂРѕРІР°РЅРёСЏ РІСЂРµРјРµРЅРЅС‹С… РёРЅС‚РµСЂРІР°Р»РѕРІ РІ РєР°Р»РµРЅРґР°СЂРЅС‹Рµ РґР°С‚С‹.,1В 000+ Р°РєС‚РёРІРЅС‹С… СѓСЃС‚Р°РЅРѕРІРѕРє,6.8.1"MaxiBlocks: 2300+ Patterns, 280+ Pages, 14.3K Icons & 100 Styles",https://ru.wordpress.org/plugins/maxi-blocks/,"Build professional WordPress sites faster, boost your design confidence, and deliver higher-quality results with MaxiBlocks.",1В 000+ Р°РєС‚РёРІРЅС‹С… СѓСЃС‚Р°РЅРѕРІРѕРє,6.7.2Event Block,https://ru.wordpress.org/plugins/event/,Р‘С‹СЃС‚СЂРѕ СЃРѕР·РґР°РІР°Р№С‚Рµ РїСЂРѕСЃС‚С‹Рµ РєР°СЂС‚РѕС‡РєРё РјРµСЂРѕРїСЂРёСЏС‚РёР№ Рё РїСЂРёРіР»Р°С€РµРЅРёСЏ.,1В 000+ Р°РєС‚РёРІРЅС‹С… СѓСЃС‚Р°РЅРѕРІРѕРє,6.4.5Blocks for Eventbrite,https://ru.wordpress.org/plugins/blocks-for-eventbrite/,Gutenberg blocks that display eventbrite events.,1В 000+ Р°РєС‚РёРІРЅС‹С… СѓСЃС‚Р°РЅРѕРІРѕРє,6.6.2Simple Google Calendar Outlook Events Widget,https://ru.wordpress.org/plugins/simple-google-icalendar-widget/,Block widget that displays events from a public google calendar or iCal file.,1В 000+ Р°РєС‚РёРІРЅС‹С… СѓСЃС‚Р°РЅРѕРІРѕРє,6.8.1Simple Block Gallery,https://ru.wordpress.org/plugins/simple-block-gallery/,Add the effect of Masonry and Slider to images.,1В 000+ Р°РєС‚РёРІРЅС‹С… СѓСЃС‚Р°РЅРѕРІРѕРє,6.8.1WP eBay Product Feeds,https://ru.wordpress.org/plugins/ebay-feeds-for-wordpress/,Display feeds of eBay Products from eBay Partner Network on your site.,1В 000+ Р°РєС‚РёРІРЅС‹С… СѓСЃС‚Р°РЅРѕРІРѕРє,6.8.1"Event Monster вЂ” Event Management, Tickets Booking, Upcoming Event",https://ru.wordpress.org/plugins/event-monster/,"Event Mangement Plugin, Create Events, Manage Bookings, Manage Tickets, Sponsors, Beautiful Designed Interface, Calendar, Booking, Tickets",1В 000+ Р°РєС‚РёРІРЅС‹С… СѓСЃС‚Р°РЅРѕРІРѕРє,6.8.1Editor Blocks for Gutenberg,https://ru.wordpress.org/plugins/editor-blocks/,A unique collection of Gutenberg blocks.,900+ Р°РєС‚РёРІРЅС‹С… СѓСЃС‚Р°РЅРѕРІРѕРє,5.5.15Gutenberg Blocks Templates вЂ” 50+ Free Gutenberg Block Designs,https://ru.wordpress.org/plugins/design/,рџђ° Default Gutenberg Blocks beautifully arranged in ready-to-use design sections. вњ… One-click import. вњ… 50+ free designs.,900+ Р°РєС‚РёРІРЅС‹С… СѓСЃС‚Р°РЅРѕРІРѕРє,5.1.19