"Registration, User Profile, Membership, Content Restriction, User Directory, and Frontend Post Submission вЂ“ WP User Frontend",https://ru.wordpress.org/plugins/wp-user-frontend/,"Frontend post, content restriction, user login & registration, subscription & membership, forms, user directory & profile builder for your website.",20В 000+ Р°РєС‚РёРІРЅС‹С… СѓСЃС‚Р°РЅРѕРІРѕРє,6.8.1Image Photo Gallery Final Tiles Grid,https://ru.wordpress.org/plugins/final-tiles-grid-gallery-lite/,Р“Р°Р»РµСЂРµСЏ РёР·РѕР±СЂР°Р¶РµРЅРёР№ + Р“Р°Р»РµСЂРµСЏ С„РѕС‚РѕРіСЂР°С„РёР№ + Р“Р°Р»РµСЂРµСЏ РїРѕСЂС‚С„РѕР»РёРѕ + РџР»РёС‚РѕС‡РЅР°СЏ РіР°Р»РµСЂРµСЏ РІ 1 РїР»Р°РіРёРЅРµ. Р’РєР»СЋС‡Р°РµС‚ Р»Р°Р№С‚Р±РѕРєСЃ Рё СЌС„С„РµРєС‚С‹ РїСЂРё РЅР°РІРµРґРµРЅРёРё. РћРЅ РїРѕРґРґРµСЂР¶РёРІР°РµС‚ Pinterest (РєРёСЂРїРёС‡РЅР°СЏ РєР»Р°РґРєР°) ph & hellip;,20В 000+ Р°РєС‚РёРІРЅС‹С… СѓСЃС‚Р°РЅРѕРІРѕРє,6.8.1Slider by 10Web вЂ” Responsive Image Slider,https://ru.wordpress.org/plugins/slider-wd/,Slider by 10Web plugin is the perfect slider solution for Wordpress.,20В 000+ Р°РєС‚РёРІРЅС‹С… СѓСЃС‚Р°РЅРѕРІРѕРє,5.8.10Р‘Р»РѕРє РєР°СЂС‚ РґР»СЏ Google Maps,https://ru.wordpress.org/plugins/map-block-gutenberg/,Р‘Р»РѕРє РєР°СЂС‚ РґР»СЏ СЂРµРґР°РєС‚РѕСЂР° Gutenberg СЂР°Р±РѕС‚Р°РµС‚ РЅР° Google Maps. РџСЂРѕСЃС‚Рѕ. Р‘С‹СЃС‚СЂРѕ. РќРёС‡РµРіРѕ Р»РёС€РЅРµРіРѕ. РџСЂРѕСЃС‚Рѕ Р±Р»РѕРє РєР°СЂС‚.,20В 000+ Р°РєС‚РёРІРЅС‹С… СѓСЃС‚Р°РЅРѕРІРѕРє,6.8.110WebSocial,https://ru.wordpress.org/plugins/wd-instagram-feed/,10Web,20В 000+ Р°РєС‚РёРІРЅС‹С… СѓСЃС‚Р°РЅРѕРІРѕРє,5.0.22All-in-One Video Gallery,https://ru.wordpress.org/plugins/all-in-one-video-gallery/,"The ultimate video player & video gallery plugin for YouTubers, Video Bloggers, Course Creators, Podcasters, and anyone embedding videos on websites.",20В 000+ Р°РєС‚РёРІРЅС‹С… СѓСЃС‚Р°РЅРѕРІРѕРє,6.8.1"UsersWP вЂ” Front-end login form, User Registration, User Profile & Members Directory plugin for WP",https://ru.wordpress.org/plugins/userswp/,"Light weight Front-end login form, User Registration, User Profile and Members Directory plugin.",20В 000+ Р°РєС‚РёРІРЅС‹С… СѓСЃС‚Р°РЅРѕРІРѕРє,6.8.1Page View Count,https://ru.wordpress.org/plugins/page-views-count/,"Places an icon, all time views count and views today count at the bottom of posts, pages and custom post types on any WordPress website.",20В 000+ Р°РєС‚РёРІРЅС‹С… СѓСЃС‚Р°РЅРѕРІРѕРє,6.8.1Appointment Hour Booking вЂ” РџР»Р°РіРёРЅ WordPress Р±СЂРѕРЅРёСЂРѕРІР°РЅРёСЏ,https://ru.wordpress.org/plugins/appointment-hour-booking/,Appointment Hour Booking вЂ” СЌС‚Рѕ РїР»Р°РіРёРЅ РґР»СЏ СЃРѕР·РґР°РЅРёСЏ С„РѕСЂРј Р±СЂРѕРЅРёСЂРѕРІР°РЅРёСЏ РІСЃС‚СЂРµС‡ СЃ СѓРєР°Р·Р°РЅРёРµРј РІСЂРµРјРµРЅРё РЅР°С‡Р°Р»Р° Рё Р·Р°РґР°РЅРЅРѕР№ РїСЂРѕРґРѕР»Р¶РёС‚РµР»СЊРЅРѕСЃС‚Рё РїРѕ СЂР°СЃРїРёСЃР°РЅРёСЋ.,20В 000+ Р°РєС‚РёРІРЅС‹С… СѓСЃС‚Р°РЅРѕРІРѕРє,6.8.1The Events Calendar Shortcode & Block,https://ru.wordpress.org/plugins/the-events-calendar-shortcode/,"Add shortcode, block, Elementor and Bricks functionality to The Events Calendar Plugin, so you can easily list and promote your events anywhere.",20В 000+ Р°РєС‚РёРІРЅС‹С… СѓСЃС‚Р°РЅРѕРІРѕРє,6.8.1Directorist: AI-Powered Business Directory Plugin with Classified Ads Listings,https://ru.wordpress.org/plugins/directorist/,"An Excellent WP Directory Plugin to Create Business Directories, Job Listings, Classified Ads, Booking Directories, Local Directories, and Service Dir вЂ¦",20В 000+ Р°РєС‚РёРІРЅС‹С… СѓСЃС‚Р°РЅРѕРІРѕРє,6.8.1YASR вЂ” Yet Another Star Rating Plugin for WordPress,https://ru.wordpress.org/plugins/yet-another-stars-rating/,Boost the way people interact with your site with an easy WordPress stars rating system! With schema.org rich snippets YASR will improve your SEO,10В 000+ Р°РєС‚РёРІРЅС‹С… СѓСЃС‚Р°РЅРѕРІРѕРє,6.8.1WP Meta SEO,https://ru.wordpress.org/plugins/wp-meta-seo/,"WP Meta SEO gives you the control over all your SEO optimization. Bulk SEO content and image SEO, on page content check, 404 and redirect",10В 000+ Р°РєС‚РёРІРЅС‹С… СѓСЃС‚Р°РЅРѕРІРѕРє,6.7.2GeoDirectory вЂ” WP Business Directory Plugin and Classified Listings Directory,https://ru.wordpress.org/plugins/geodirectory/,"A superb WordPress Business Directory plugin to create a local business directory, classified ads directory, or job listings board.",10В 000+ Р°РєС‚РёРІРЅС‹С… СѓСЃС‚Р°РЅРѕРІРѕРє,6.8.1Advanced Sidebar Menu,https://ru.wordpress.org/plugins/advanced-sidebar-menu/,Fully automatic sidebar menus.,10В 000+ Р°РєС‚РёРІРЅС‹С… СѓСЃС‚Р°РЅРѕРІРѕРє,6.8.1WordPress Slider Block Gutenslider,https://ru.wordpress.org/plugins/gutenslider/,"РџР»Р°РіРёРЅ СЃР»Р°Р№РґРµСЂР° РґР»СЏ Р“СѓС‚РµРЅР±РµСЂРі. РЎРѕР·РґР°Р№С‚Рµ СЃР»Р°Р№РґРµСЂ РёР·РѕР±СЂР°Р¶РµРЅРёР№, СЃР»Р°Р№РґРµСЂ РІРёРґРµРѕ, РїРѕР»РЅРѕСЌРєСЂР°РЅРЅС‹Р№ СЃР»Р°Р№РґРµСЂ СЃ РїРѕРјРѕС‰СЊСЋ СЌС‚РѕРіРѕ РјРѕС‰РЅРѕРіРѕ Р±Р»РѕРєР° СЃР»Р°Р№РґРµСЂР° Рё РґРѕР±Р°РІСЊС‚Рµ Р»СЋР±РѕР№ Р±Р»РѕРє СЃРІРµСЂС…Сѓ.",10В 000+ Р°РєС‚РёРІРЅС‹С… СѓСЃС‚Р°РЅРѕРІРѕРє,6.4.5Events Shortcodes For The Events Calendar,https://ru.wordpress.org/plugins/template-events-calendar/,Easily add The Events Calendar shortcode or Gutenberg event block on any page and show upcoming events list.,10В 000+ Р°РєС‚РёРІРЅС‹С… СѓСЃС‚Р°РЅРѕРІРѕРє,6.8.1Highlighting Code Block,https://ru.wordpress.org/plugins/highlighting-code-block/,Р”РѕР±Р°РІСЊС‚Рµ Р±Р»РѕРє РєРѕРґР° СЃ РїРѕРґСЃРІРµС‚РєРѕР№ СЃРёРЅС‚Р°РєСЃРёСЃР° СЃ РїРѕРјРѕС‰СЊСЋ prism.js. (Р”РѕСЃС‚СѓРїРЅРѕ РґР»СЏ Gutenberg Рё Classic Editor),10В 000+ Р°РєС‚РёРІРЅС‹С… СѓСЃС‚Р°РЅРѕРІРѕРє,6.4.5"Photonic Gallery & Lightbox for Flickr, SmugMug & Others",https://ru.wordpress.org/plugins/photonic/,"Galleries on steroids! A stylish lightbox & gallery plugin for WP, Flickr, SmugMug and Zenfolio photos and videos.",10В 000+ Р°РєС‚РёРІРЅС‹С… СѓСЃС‚Р°РЅРѕРІРѕРє,6.8.1"Paid Membership Subscriptions вЂ” Effortless Memberships, Recurring Payments & Content Restriction",https://ru.wordpress.org/plugins/paid-member-subscriptions/,"Feature-packed membership plugin for creating subscription plans, adding recurring payments & content restriction on your membership site.",10В 000+ Р°РєС‚РёРІРЅС‹С… СѓСЃС‚Р°РЅРѕРІРѕРє,6.8.1"GamiPress вЂ” Gamification plugin to reward points, achievements, badges & ranks in WordPress",https://ru.wordpress.org/plugins/gamipress/,"Boost your gamification marketing & reward your users with points, achievements, badges & ranks to increase your site activity & loyalty!",10В 000+ Р°РєС‚РёРІРЅС‹С… СѓСЃС‚Р°РЅРѕРІРѕРє,6.8.1HivePress вЂ” РџР»Р°РіРёРЅ WordPress РґР»СЏ Р±РёР·РЅРµСЃ-РєР°С‚Р°Р»РѕРіРѕРІ Рё РґРѕСЃРѕРє РѕР±СЉСЏРІР»РµРЅРёР№,https://ru.wordpress.org/plugins/hivepress/,"РџСЂРѕСЃС‚РѕР№, РЅРѕ РјРѕС‰РЅС‹Р№ РїР»Р°РіРёРЅ РґР»СЏ СЃРѕР·РґР°РЅРёСЏ Р±РёР·РЅРµСЃ-РєР°С‚Р°Р»РѕРіР°, РґРѕСЃРєРё РѕР±СЉСЏРІР»РµРЅРёР№, СЃР°Р№С‚Р° РїРѕ РїРѕРёСЃРєСѓ СЂР°Р±РѕС‚С‹, РЅРµРґРІРёР¶РёРјРѕСЃС‚Рё РёР»Рё Р»СЋР±РѕРіРѕ РґСЂСѓРіРѕРіРѕ СЃР°Р№С‚Р°-РєР°С‚Р°Р»РѕРіР°.",10В 000+ Р°РєС‚РёРІРЅС‹С… СѓСЃС‚Р°РЅРѕРІРѕРє,6.8.1WP VR вЂ” РєРѕРЅСЃС‚СЂСѓРєС‚РѕСЂ 360 РїР°РЅРѕСЂР°Рј Рё РІРёСЂС‚СѓР°Р»СЊРЅС‹С… С‚СѓСЂРѕРІ РґР»СЏ WordPress,https://ru.wordpress.org/plugins/wpvr/,Let your visitors take a virtual tour of your place & make them excited. Impress them with a 360 degree live tour.,10В 000+ Р°РєС‚РёРІРЅС‹С… СѓСЃС‚Р°РЅРѕРІРѕРє,6.7.2Pricing Table WordPress Plugin вЂ” Easy Pricing Tables,https://ru.wordpress.org/plugins/easy-pricing-tables/,"Pricing Table Plugin вЂ” Easy Pricing Tables Lets You Create A Beautiful, Responsive Pricing Table In 2 Minutes. No Coding Required.",10В 000+ Р°РєС‚РёРІРЅС‹С… СѓСЃС‚Р°РЅРѕРІРѕРє,6.8.1Visual Link Preview,https://ru.wordpress.org/plugins/visual-link-preview/,РћС‚РѕР±СЂР°Р¶Р°С‚СЊ РїРѕР»РЅРѕСЃС‚СЊСЋ РЅР°СЃС‚СЂР°РёРІР°РµРјС‹Р№ РїСЂРµРґРІР°СЂРёС‚РµР»СЊРЅС‹Р№ РїСЂРѕСЃРјРѕС‚СЂ РІРёР·СѓР°Р»СЊРЅРѕР№ СЃСЃС‹Р»РєРё РґР»СЏ Р»СЋР±РѕР№ РІРЅСѓС‚СЂРµРЅРЅРµР№ РёР»Рё РІРЅРµС€РЅРµР№ СЃСЃС‹Р»РєРё.,10В 000+ Р°РєС‚РёРІРЅС‹С… СѓСЃС‚Р°РЅРѕРІРѕРє,6.8.1Five Star Restaurant Reservations вЂ” WordPress Booking Plugin,https://ru.wordpress.org/plugins/restaurant-reservations/,"Restaurant reservations made easy. Accept bookings online. Quickly confirm or reject reservations, send email notifications, set booking times and mor вЂ¦",10В 000+ Р°РєС‚РёРІРЅС‹С… СѓСЃС‚Р°РЅРѕРІРѕРє,6.8.1WP Tabs вЂ“ Responsive Tabs and Custom Product Tabs,https://ru.wordpress.org/plugins/wp-expand-tabs-free/,"The most user-friendly, highly customizable, responsive WordPress tabs plugin to display your content in a clean organized tabbed navigation.",10В 000+ Р°РєС‚РёРІРЅС‹С… СѓСЃС‚Р°РЅРѕРІРѕРє,6.8.1LIQUID SPEECH BALLOON,https://ru.wordpress.org/plugins/liquid-speech-balloon/,Create a talk style (еђ№гЃЌе‡єгЃ—) design in the block editor.,10В 000+ Р°РєС‚РёРІРЅС‹С… СѓСЃС‚Р°РЅРѕРІРѕРє,6.7.2Algori 360 Image,https://ru.wordpress.org/plugins/360-image/,Algori 360 Image is a Gutenberg Block Plugin that enables you add interactive 360В° images to your WordPress website.,10В 000+ Р°РєС‚РёРІРЅС‹С… СѓСЃС‚Р°РЅРѕРІРѕРє,6.7.2Bootstrap Blocks,https://ru.wordpress.org/plugins/wp-bootstrap-blocks/,Bootstrap Gutenberg Blocks for WordPress. This plugin adds Bootstrap components and layout options as Gutenberg blocks.,10В 000+ Р°РєС‚РёРІРЅС‹С… СѓСЃС‚Р°РЅРѕРІРѕРє,6.8.1WP User Manager вЂ” User Profile Builder & Membership,https://ru.wordpress.org/plugins/wp-user-manager/,"The most customizable profiles & community builder WordPress plugin with front-end login, registration, profile customization and content restriction.",10В 000+ Р°РєС‚РёРІРЅС‹С… СѓСЃС‚Р°РЅРѕРІРѕРє,6.7.2"Countdown, Coming Soon, Maintenance вЂ” Countdown & Clock",https://ru.wordpress.org/plugins/countdown-builder/,Countdown builder вЂ” Customizable Countdown Timer,10В 000+ Р°РєС‚РёРІРЅС‹С… СѓСЃС‚Р°РЅРѕРІРѕРє,6.8.1Countdown Timer вЂ” Widget Countdown,https://ru.wordpress.org/plugins/widget-countdown/,РўР°Р№РјРµСЂ РѕР±СЂР°С‚РЅРѕРіРѕ РѕС‚СЃС‡РµС‚Р° СЌС‚Рѕ РїСЂРёСЏС‚РЅС‹Р№ РёРЅСЃС‚СЂСѓРјРµРЅС‚ РґР»СЏ СЃРѕР·РґР°РЅРёСЏ Рё РІСЃС‚Р°РІРєРё С‚Р°Р№РјРµСЂРѕРІ РІ РІР°С€Рё СЃС‚Р°С‚СЊРё/СЃС‚СЂР°РЅРёС†С‹ Рё РІРёРґР¶РµС‚С‹.,10В 000+ Р°РєС‚РёРІРЅС‹С… СѓСЃС‚Р°РЅРѕРІРѕРє,6.7.2Hotel Booking Lite,https://ru.wordpress.org/plugins/motopress-hotel-booking-lite/,"The #1 Hotel Booking and Vacation Rental Plugin for WordPress. Online payments, seasons, rates, free or paid extras, coupons, taxes & fees.",10В 000+ Р°РєС‚РёРІРЅС‹С… СѓСЃС‚Р°РЅРѕРІРѕРє,6.8.1Simple Newsletter Plugin вЂ” Noptin,https://ru.wordpress.org/plugins/newsletter-optin-box/,The fastest GDPR-compliant automation and newsletter plugin. Collect unlimited newsletter subscribers and send them newsletters or new post notificati вЂ¦,10В 000+ Р°РєС‚РёРІРЅС‹С… СѓСЃС‚Р°РЅРѕРІРѕРє,6.8.1Contact Form Email,https://ru.wordpress.org/plugins/contact-form-to-email/,"Contact form with visual form builder. Contact form that sends the data to email, to a database list and to CSV / Excel files.",10В 000+ Р°РєС‚РёРІРЅС‹С… СѓСЃС‚Р°РЅРѕРІРѕРє,6.8.1Elementor Blocks for Gutenberg,https://ru.wordpress.org/plugins/block-builder/,"Elementor Blocks for Gutenberg, РѕС„РёС†РёР°Р»СЊРЅРѕ СЃРѕР·РґР°РЅРЅС‹Р№ Elementor Page Builder, РїРѕР·РІРѕР»СЏРµС‚ Р»РµРіРєРѕ РІСЃС‚Р°РІРёС‚СЊ Р»СЋР±РѕР№ С€Р°Р±Р»РѕРЅ Elementor РІ Gutenberg.",10В 000+ Р°РєС‚РёРІРЅС‹С… СѓСЃС‚Р°РЅРѕРІРѕРє,6.7.2Timeline Express,https://ru.wordpress.org/plugins/timeline-express/,"Timeline Express creates a beautiful vertical animated and responsive timeline of posts, in chronological order.",10В 000+ Р°РєС‚РёРІРЅС‹С… СѓСЃС‚Р°РЅРѕРІРѕРє,6.2.6Podcast Player вЂ” Your Podcasting Companion,https://ru.wordpress.org/plugins/podcast-player/,"Showcase your podcast only using podcasting feed url. Use widget, shortcode or editor block to display podcast player anywhere on your site.",10В 000+ Р°РєС‚РёРІРЅС‹С… СѓСЃС‚Р°РЅРѕРІРѕРє,6.8.1Meow Gallery,https://ru.wordpress.org/plugins/meow-gallery/,"Polished, beautiful gallery built for simplicity and speed. Features Gallery Block, shortcode, or overrides standard WordPress gallery.",10В 000+ Р°РєС‚РёРІРЅС‹С… СѓСЃС‚Р°РЅРѕРІРѕРє,6.8.1Recipe Card Blocks for Gutenberg & Elementor вЂ” Best WordPress Recipe Plugin,https://ru.wordpress.org/plugins/recipe-card-blocks-by-wpzoom/,Beautiful Recipe Card Blocks for Food Bloggers with Schema Markup (JSON-LD) for the new WordPress editor (Gutenberg),10В 000+ Р°РєС‚РёРІРЅС‹С… СѓСЃС‚Р°РЅРѕРІРѕРє,6.8.1Qubely вЂ” СЂР°СЃС€РёСЂРµРЅРЅС‹Рµ Р±Р»РѕРєРё Gutenberg,https://ru.wordpress.org/plugins/qubely/,Р“РѕС‚РѕРІС‹Рµ Р±Р»РѕРєРё Рё СЂР°Р·РґРµР»С‹ Gutenberg СЃ С€РёСЂРѕРєРёРјРё РІРѕР·РјРѕР¶РЅРѕСЃС‚СЏРјРё РЅР°СЃС‚СЂРѕР№РєРё. РЈР»СѓС‡С€РёС‚Рµ СЂРµРґР°РєС‚РѕСЂ Gutenberg СЃ РїРѕРјРѕС‰СЊСЋ РїСЂРѕСЃС‚РѕРіРѕ РїРѕР»СЊР·РѕРІР°С‚РµР»СЊСЃРєРѕРіРѕ РёРЅС‚РµСЂС„РµР№СЃР° Рё С„СѓРЅРєС†РёРѕРЅР°Р»СЊРЅС‹С… Р±Р»РѕРєРѕРІ.,10В 000+ Р°РєС‚РёРІРЅС‹С… СѓСЃС‚Р°РЅРѕРІРѕРє,6.7.2Auto Amazon Links вЂ” Amazon Associates Affiliate Plugin,https://ru.wordpress.org/plugins/amazon-auto-links/,Generates Amazon affiliate links of products just coming out today. Pick categories and they appear even in JavaScript-disabled browsers.,10В 000+ Р°РєС‚РёРІРЅС‹С… СѓСЃС‚Р°РЅРѕРІРѕРє,6.5.5FAQ / Accordion / Docs / KB вЂ“ Helpie WordPress FAQ Accordion plugin,https://ru.wordpress.org/plugins/helpie-faq/,"Accordion , FAQ & Docs builder with Drag and Drop features. Helpie Accordion FAQ plugin works with Helpie Knowledge Base , Woocommerce & Elementor",10В 000+ Р°РєС‚РёРІРЅС‹С… СѓСЃС‚Р°РЅРѕРІРѕРє,6.6.2WS Form LITE вЂ” Drag & Drop Contact Form Builder for WordPress,https://ru.wordpress.org/plugins/ws-form/,"Form builder for WordPress: Rapidly build professional, stylish, mobile-friendly, accessible forms for WordPress.",9В 000+ Р°РєС‚РёРІРЅС‹С… СѓСЃС‚Р°РЅРѕРІРѕРє,6.8.1eCommerce Product Catalog РџР»Р°РіРёРЅ РґР»СЏ WordPress,https://ru.wordpress.org/plugins/ecommerce-product-catalog/,eCommerce Product Catalog is a powerful and free plugin to sell with a beautiful eCommerce or request for a quote WordPress website.,9В 000+ Р°РєС‚РёРІРЅС‹С… СѓСЃС‚Р°РЅРѕРІРѕРє,6.8.1Better Click To Tweet,https://ru.wordpress.org/plugins/better-click-to-tweet/,"Insert styled call-out boxes into your posts, simply and securely. Encourage readers to share your content on X in one simple action.",8В 000+ Р°РєС‚РёРІРЅС‹С… СѓСЃС‚Р°РЅРѕРІРѕРє,6.8.1Easy Maps Block,https://ru.wordpress.org/plugins/easy-maps-block/,Insert a Google Map into the Gutenberg editor.,8В 000+ Р°РєС‚РёРІРЅС‹С… СѓСЃС‚Р°РЅРѕРІРѕРє,6.6.2Algori PDF Viewer,https://ru.wordpress.org/plugins/algori-pdf-viewer/,Algori PDF Viewer is a Gutenberg Block Plugin that enables you to easily display PDF documents directly on your website.,8В 000+ Р°РєС‚РёРІРЅС‹С… СѓСЃС‚Р°РЅРѕРІРѕРє,6.6.2Five Star Business Profile and Schema,https://ru.wordpress.org/plugins/business-profile/,Add structured data to any page or post type. Create an SEO friendly contact card with your business info and associated schema.,8В 000+ Р°РєС‚РёРІРЅС‹С… СѓСЃС‚Р°РЅРѕРІРѕРє,6.8.1Automatic YouTube Gallery,https://ru.wordpress.org/plugins/automatic-youtube-gallery/,"РЎРѕР·РґР°РІР°Р№С‚Рµ РґРёРЅР°РјРёС‡РµСЃРєРёРµ РІРёРґРµРѕРіР°Р»РµСЂРµРё, РїСЂРѕСЃС‚Рѕ РґРѕР±Р°РІР»СЏСЏ РРњРЇ РџРћР›Р¬Р—РћР’РђРўР•Р›РЇ YouTube, РљРђРќРђР›, РЎРџРРЎРћРљ Р’РћРЎРџР РћРР—Р’Р•Р”Р•РќРРЇ, РЎР РћРљ РџРћРРЎРљРђ РёР»Рё РЅР°СЃС‚СЂР°РёРІР°РµРјС‹Р№ СЃРїРёСЃРѕРє URL-Р°РґСЂРµСЃРѕРІ РІРёРґРµРѕ.",8В 000+ Р°РєС‚РёРІРЅС‹С… СѓСЃС‚Р°РЅРѕРІРѕРє,6.8.1"Blog Filter вЂ” Advanced Post Filtering with Categories Or Tags, Post Portfolio Gallery, Blog Design Template, Blog Post Layout",https://ru.wordpress.org/plugins/blog-filter/,"Blog Filter: Effortlessly organize posts with grid designs, masonry layouts, and category/tag filters. Create stunning post portfolios and galleries.",8В 000+ Р°РєС‚РёРІРЅС‹С… СѓСЃС‚Р°РЅРѕРІРѕРє,6.8.1If-So Dynamic Content Personalization,https://ru.wordpress.org/plugins/if-so/,РџРµСЂСЃРѕРЅР°Р»РёР·РёСЂСѓР№С‚Рµ Р»СЋР±РѕРµ СЃРѕРґРµСЂР¶РёРјРѕРµ. Р”РѕР±Р°РІР»СЏР№С‚Рµ РёР»Рё Р·Р°РјРµРЅСЏР№С‚Рµ Р»СЋР±РѕРµ СЃРѕРґРµСЂР¶РёРјРѕРµ РІ Р·Р°РІРёСЃРёРјРѕСЃС‚Рё РѕС‚ РїСЂРѕС„РёР»СЏ РїРѕР»СЊР·РѕРІР°С‚РµР»СЏ РёР»Рё РµРіРѕ РІР·Р°РёРјРѕРґРµР№СЃС‚РІРёСЏ СЃ СЃР°Р№С‚РѕРј Р±РµР· РЅР°РІС‹РєРѕРІ РїСЂРѕРіСЂР°РјРјРёСЂРѕРІР°РЅРёСЏ!,8В 000+ Р°РєС‚РёРІРЅС‹С… СѓСЃС‚Р°РЅРѕРІРѕРє,6.8.1"РџРѕСЂС‚С„РѕР»РёРѕ, Gallery, Product Catalog вЂ” Grid KIT РџРѕСЂС‚С„РѕР»РёРѕ",https://ru.wordpress.org/plugins/portfolio-wp/,"РџРѕСЂС‚С„РѕР»РёРѕ, gallery, product catalog, teams, logos and more. All-in-one plugin вЂ” Grid Kit РџРѕСЂС‚С„РѕР»РёРѕ Gallery",8В 000+ Р°РєС‚РёРІРЅС‹С… СѓСЃС‚Р°РЅРѕРІРѕРє,6.6.2"Ghost Kit вЂ“ Page Builder Blocks, Motion Effects & Extensions",https://ru.wordpress.org/plugins/ghostkit/,"Create engaging websites using over 25 advanced blocks featuring motion effects, smooth animations, and robust extensions.",7В 000+ Р°РєС‚РёРІРЅС‹С… СѓСЃС‚Р°РЅРѕРІРѕРє,6.7.2Simple Iframe,https://ru.wordpress.org/plugins/simple-iframe/,Easily insert iframes inside the block editor.,7В 000+ Р°РєС‚РёРІРЅС‹С… СѓСЃС‚Р°РЅРѕРІРѕРє,6.6.0"Poll Maker вЂ” Versus Polls, Anonymous Polls, Image Polls",https://ru.wordpress.org/plugins/poll-maker/,"Poll Maker вЂ” СЌС‚Рѕ Р‘Р•РЎРџР›РђРўРќР«Р™ РїР»Р°РіРёРЅ РґР»СЏ РѕРїСЂРѕСЃРѕРІ WordPress, РєРѕС‚РѕСЂС‹Р№ РїРѕР·РІРѕР»РёС‚ РІР°Рј СЃРѕР·РґР°РІР°С‚СЊ РЅР°СЃС‚СЂР°РёРІР°РµРјС‹Рµ Рё РїСЂРѕС„РµСЃСЃРёРѕРЅР°Р»СЊРЅС‹Рµ РѕРЅР»Р°Р№РЅ-РѕРїСЂРѕСЃС‹ Рё РіРѕР»РѕСЃРѕРІР°РЅРёСЏ РґР»СЏ РІР°С€РµРіРѕ РІРµР±-СЃР°Р№С‚Р° WordPress.",7В 000+ Р°РєС‚РёРІРЅС‹С… СѓСЃС‚Р°РЅРѕРІРѕРє,6.8.1"Print My Blog вЂ” Print, PDF, & eBook Converter WordPress Plugin",https://ru.wordpress.org/plugins/print-my-blog/,РЎРѕР·РґР°Р№С‚Рµ РїРµС‡Р°С‚РЅСѓСЋ РІРµСЂСЃРёСЋ РІР°С€РµРіРѕ Р±Р»РѕРіР° РїСЂРѕСЃС‚Рѕ Рё РІС‹СЂР°Р·РёС‚РµР»СЊРЅРѕ. Р”Р»СЏ РІР°СЃ & РІР°С€РёС… РїРѕСЃРµС‚РёС‚РµР»РµР№. РќРµ РІР°Р¶РЅРѕ вЂ” РѕРґРёРЅ РїРѕСЃС‚ РёР»Рё С‚С‹СЃСЏС‡Р°.,7В 000+ Р°РєС‚РёРІРЅС‹С… СѓСЃС‚Р°РЅРѕРІРѕРє,6.8.1GutenBee вЂ” Gutenberg Blocks,https://ru.wordpress.org/plugins/gutenbee/,GutenBee enhances the Gutenberg editor with more blocks!,7В 000+ Р°РєС‚РёРІРЅС‹С… СѓСЃС‚Р°РЅРѕРІРѕРє,6.8.1"ProfileGrid вЂ” РїСЂРѕС„РёР»СЊ, РіСЂСѓРїРїС‹ Рё СЃРѕРѕР±С‰РµСЃС‚РІР°",https://ru.wordpress.org/plugins/profilegrid-user-profiles-groups-and-communities/,"Custom user profiles plugin вќ¤ with paid memberships, groups, communities, content restriction, user registration, messaging, WooCommerce memberships,  вЂ¦",7В 000+ Р°РєС‚РёРІРЅС‹С… СѓСЃС‚Р°РЅРѕРІРѕРє,6.8.1Create by Mediavine,https://ru.wordpress.org/plugins/mediavine-create/,Complete tool for creating and publishing recipes and other schema types on your site.,7В 000+ Р°РєС‚РёРІРЅС‹С… СѓСЃС‚Р°РЅРѕРІРѕРє,6.6.2Google Analytics Opt-Out,https://ru.wordpress.org/plugins/google-analytics-opt-out/,Provides opt-out functionality for Google Analytics.,6В 000+ Р°РєС‚РёРІРЅС‹С… СѓСЃС‚Р°РЅРѕРІРѕРє,6.2.6Get Use APIs вЂ” JSON Content Importer,https://ru.wordpress.org/plugins/json-content-importer/,"Connects an API to WordPress: Get API-data (JSON, XML, CSVвЂ¦), show it with a Shortcode, a JCI Block or PHP.  Generate a template with the JCI Block",6В 000+ Р°РєС‚РёРІРЅС‹С… СѓСЃС‚Р°РЅРѕРІРѕРє,6.8.1Sticky Block for Gutenberg Editor,https://ru.wordpress.org/plugins/sticky-block/,The Gutenberg Sticky Block will stick at the top of the page once you scroll down.,6В 000+ Р°РєС‚РёРІРЅС‹С… СѓСЃС‚Р°РЅРѕРІРѕРє,6.8.1Five Star Restaurant Menu and Food Ordering,https://ru.wordpress.org/plugins/food-and-drink-menu/,Restaurant menu and food ordering system that is easy to set up and integrates with any theme. Includes restaurant menu blocks and patterns.,6В 000+ Р°РєС‚РёРІРЅС‹С… СѓСЃС‚Р°РЅРѕРІРѕРє,6.8.1